key,comp_level,set_number,match_number,team_key,a_Proc,start_Pos_5isBlue,a_reefAlgae,a_L1,t_Defense,t_timeFrozen,t_reefAlgae,t_Net,t_Proc,t_L4,t_L3,t_L2,t_L1,a_L3,end_Pos,a_L4,auto_Notes,tele_Notes,endgame_Notes,match_Scouter,a_L2,stuck_on_alg,a_Leave,a_Net,no_show,r1,b2,b3,ba_redscore,ba_bluescore,r2,r3,b1,ba_winning_alliance,ba_autoCoralPoints,ba_autoLineRobot1,ba_autoLineRobot2,ba_autoLineRobot3,ba_autoMobilityPoints,ba_autoPoints,ba_bargeBonusAchieved,ba_coopertitionCriteriaMet,ba_coralBonusAchieved,ba_endGameBargePoints,ba_endGameRobot1,ba_endGameRobot2,ba_endGameRobot3,ba_foulCount,ba_foulPoints,ba_g206Penalty,ba_g410Penalty,ba_g418Penalty,ba_g428Penalty,ba_netAlgaeCount,ba_rp,ba_techFoulCount,ba_teleopCoralCount,ba_teleopCoralPoints,ba_teleopPoints,ba_totalPoints,ba_wallAlgaeCount,ba_adjustPoints,ba_algaePoints,ba_autoBonusAchieved,ba_autoCoralCount
2025pncmp_qm43,qm,1,43,frc6343,0,1,0,0,0,0,0,0,0,3,5,0,0,0,Deep Climb,0,Just barely left start zone and interfered with another alliance members auto,decent with coal but that's all,their deep climb was a little slow but it still finished,naman,0,0,1,0,0,frc6343,frc4450,frc948,186,147,frc2557,frc9036,frc2147,red,6,Yes,Yes,Yes,9,15,1,1,0,24,DeepCage,DeepCage,None,0,12,0,0,1,0,4,5,3,27,107,159,186,2,0,28,1,2
2025pncmp_qm43,qm,1,43,frc2557,0,3,2,1,0,0,5,3,3,0,0,0,4,0,Deep Climb,0,they got out and scored in L1. they attmpted the barge twice but they did not collect them all the way,"good third pick for us. they focus alage can remove it and score in the procesor and the barge. they can also do ground collect fast, but they can only score LI. but us 1425 have kind of struggled with L1 in some situations. also good driving.",were able to deep climb pretty fast but over 10 seconds,Hendrix Day,0,0,1,0,0,frc6343,frc4450,frc948,186,147,frc2557,frc9036,frc2147,red,6,Yes,Yes,Yes,9,15,1,1,0,24,DeepCage,DeepCage,None,0,12,0,0,1,0,4,5,3,27,107,159,186,2,0,28,1,2
2025pncmp_qm43,qm,1,43,frc9036,0,5,0,1,0,0,1,0,0,5,5,1,0,0,None,0,scoredd 1 l1 and a stopped,"the robot has a really fast pick up and placing, but it is very unreliable and is very slow at movement ",they kept scoring and got 2 coral,Aarush,0,0,1,0,0,frc6343,frc4450,frc948,186,147,frc2557,frc9036,frc2147,red,6,Yes,Yes,Yes,9,15,1,1,0,24,DeepCage,DeepCage,None,0,12,0,0,1,0,4,5,3,27,107,159,186,2,0,28,1,2
2025pncmp_qm43,qm,1,43,frc2147,0,3,1,0,0,0,3,1,0,6,6,0,0,0,Park,0,"only removed one algae, and missed the attempted barge placement","scored a total of 12 coral, 6 each on l4 and l3, also removed 3 algae well and placed one algae in the barge, they were not bad with coral or algae though.",tried to climb and practically flipped over on the side,Dev Sharma,0,0,1,0,0,frc6343,frc4450,frc948,186,147,frc2557,frc9036,frc2147,red,0,Yes,Yes,Yes,9,9,1,0,0,6,Parked,Parked,Parked,0,18,0,0,0,0,3,1,2,23,102,120,147,0,0,12,0,0
2025pncmp_qm43,qm,1,43,frc4450,0,4,0,0,1,0,0,0,0,0,0,0,0,0,Deep Climb,0,"Seems to have robot problems, showed up late and only left","Played bad defense all game. Didn't adapt to robot movements well, kept doing bad holds, no pins and bumpers actively falling off.",Dee climbed,Pranav,0,0,1,0,0,frc6343,frc4450,frc948,186,147,frc2557,frc9036,frc2147,red,0,Yes,Yes,Yes,9,9,1,0,0,6,Parked,Parked,Parked,0,18,0,0,0,0,3,1,2,23,102,120,147,0,0,12,0,0
2025pncmp_qm43,qm,1,43,frc948,0,1,0,0,0,0,1,0,0,6,3,2,0,0,Shallow Climb,0,"attempted one missed, then went to station collect till teleop"," Very Shakey placing innacurete, but quick","I don't know what climb they did, but it took the eightish seconds,",aw,0,0,1,0,0,frc6343,frc4450,frc948,186,147,frc2557,frc9036,frc2147,red,0,Yes,Yes,Yes,9,9,1,0,0,6,Parked,Parked,Parked,0,18,0,0,0,0,3,1,2,23,102,120,147,0,0,12,0,0
2025pncmp_qm44,qm,1,44,frc4043,0,3,0,0,0,0,2,0,0,0,5,5,0,0,Deep Climb,1,left start zone a little later and placed on level four,pretty fast cycles and quick intake,can deep climb decently fast,Naman,0,0,1,0,0,frc4043,frc4125,frc6696,235,191,frc488,frc2910,frc5468,red,41,Yes,Yes,Yes,9,50,1,1,1,24,DeepCage,None,DeepCage,0,4,0,0,0,0,6,6,0,39,121,181,235,2,0,36,1,6
2025pncmp_qm44,qm,1,44,frc488,0,1,0,0,0,0,1,0,0,3,0,2,1,0,None,2,they had a good auto but they had to try twice for collecting a second coral which slowed them down,"they were able to remove and collect alage, but they were not confident in scoring it and did not go for the barge. they were good at coral, they have a good funnel, good speed and nice placing. but when their side was crowded they were really slowed down and their was a 20 second peiod where they could not collect because temates did not leave room for it ","keep on scoring, potentially can climb.",Hendrix Day,0,0,1,0,0,frc4043,frc4125,frc6696,235,191,frc488,frc2910,frc5468,red,41,Yes,Yes,Yes,9,50,1,1,1,24,DeepCage,None,DeepCage,0,4,0,0,0,0,6,6,0,39,121,181,235,2,0,36,1,6
2025pncmp_qm44,qm,1,44,frc2910,0,5,0,0,0,0,1,4,2,4,6,7,1,1,Deep Climb,2,"they scored 2 l4 and 1 l3, but they missed an l4","they have super fast everything, and they do it with precision as well",2 sec climb,Aarush V,0,0,1,0,0,frc4043,frc4125,frc6696,235,191,frc488,frc2910,frc5468,red,41,Yes,Yes,Yes,9,50,1,1,1,24,DeepCage,None,DeepCage,0,4,0,0,0,0,6,6,0,39,121,181,235,2,0,36,1,6
2025pncmp_qm44,qm,1,44,frc5468,0,4,1,0,0,0,2,0,0,5,6,6,0,0,Deep Climb,3,"really good, 3 coral auto and removed one algae as well, swift and smooth","placing was incredibly fast, 17 coral and placing was also accurate. One if the best coral bots.","deep climbed in around 4 seconds, well over the ground",Dev Sharma,0,0,1,0,0,frc4043,frc4125,frc6696,235,191,frc488,frc2910,frc5468,red,31,Yes,Yes,Yes,9,40,1,1,1,16,DeepCage,Parked,Parked,2,0,0,0,0,0,2,3,0,33,115,151,191,2,0,20,1,5
2025pncmp_qm44,qm,1,44,frc4125,0,3,0,1,1,0,0,0,2,0,0,0,0,0,Park,0,"Left start, placed L1","Ran algae cycles, grabbed from lollipop and placed in proccessor, takes way too long to process though and inaccurate. Played bad defense at end at opp station, got stuck on algae but 4043 bailed them out",Parked ,Pranav,0,1,1,0,0,frc4043,frc4125,frc6696,235,191,frc488,frc2910,frc5468,red,31,Yes,Yes,Yes,9,40,1,1,1,16,DeepCage,Parked,Parked,2,0,0,0,0,0,2,3,0,33,115,151,191,2,0,20,1,5
2025pncmp_qm44,qm,1,44,frc6696,0,1,0,0,0,0,2,0,0,3,5,2,0,0,Park,1,"Missed, then collected overall quite slow","missed about three times, not bad but not great, slow",Went over with twoish senconds left,aw,0,0,1,0,0,frc4043,frc4125,frc6696,235,191,frc488,frc2910,frc5468,red,31,Yes,Yes,Yes,9,40,1,1,1,16,DeepCage,Parked,Parked,2,0,0,0,0,0,2,3,0,33,115,151,191,2,0,20,1,5
2025pncmp_qm45,qm,1,45,frc1540,0,2,0,0,0,0,1,1,0,1,6,2,6,0,Deep Climb,2,attempted four coal but far from accurate,great and smooth cycles but that being said coral placement was not accurate,can deep climb fast,naman,0,0,1,0,0,frc1540,frc1425,frc4061,166,193,frc3826,frc957,frc3674,blue,31,Yes,No,Yes,6,37,1,0,1,24,DeepCage,None,DeepCage,0,0,0,0,0,0,1,3,0,31,101,129,166,0,0,4,1,5
2025pncmp_qm45,qm,1,45,frc3826,0,0,0,0,0,0,0,0,0,0,0,0,0,0,None,0,they could not compete,,,Hendrix Dayn h,0,0,0,0,1,frc1540,frc1425,frc4061,166,193,frc3826,frc957,frc3674,blue,31,Yes,No,Yes,6,37,1,0,1,24,DeepCage,None,DeepCage,0,0,0,0,0,0,1,3,0,31,101,129,166,0,0,4,1,5
2025pncmp_qm45,qm,1,45,frc957,0,4,0,1,0,0,2,0,0,7,1,0,3,0,Deep Climb,2,they missed l4 one time and it trickled down ,they focused on coral. they were smooth and fast. they were the slowest on placing and their robot is not the fastest moving. they were able to score on all levels. consistent no real miscues. ,able to deep climb pretty fast,Hendrix Day,0,0,1,0,0,frc1540,frc1425,frc4061,166,193,frc3826,frc957,frc3674,blue,31,Yes,No,Yes,6,37,1,0,1,24,DeepCage,None,DeepCage,0,0,0,0,0,0,1,3,0,31,101,129,166,0,0,4,1,5
2025pncmp_qm45,qm,1,45,frc3674,0,2,0,0,0,0,1,0,0,1,4,6,0,0,Deep Climb,3,"Good, got 3 coral auto, reliabke","got 11 coral, had pretty consistent cycles, incapable of l1 though","deep climbed relatively fast, well over ground",Dev Sharma,0,0,1,0,0,frc1540,frc1425,frc4061,166,193,frc3826,frc957,frc3674,blue,48,Yes,Yes,Yes,9,57,1,0,0,24,DeepCage,DeepCage,None,0,0,0,0,0,0,2,5,0,34,104,136,193,0,0,8,1,7
2025pncmp_qm45,qm,1,45,frc1425,0,4,0,0,0,0,2,2,0,5,4,0,0,0,Deep Climb,3,"3 coral auto worked great, ","Very accurate on all levels except L1, good barge shots, able to do consistently, speedy ",Deep climb,Pranav,0,0,1,0,0,frc1540,frc1425,frc4061,166,193,frc3826,frc957,frc3674,blue,48,Yes,Yes,Yes,9,57,1,0,0,24,DeepCage,DeepCage,None,0,0,0,0,0,0,2,5,0,34,104,136,193,0,0,8,1,7
2025pncmp_qm45,qm,1,45,frc4061,0,3,0,0,0,0,2,0,0,0,3,5,0,1,None,0,"Slow, didn't do a lot","lots of seemingly unnecessary spinning, inaccurate, algae taking off didn't seem purposeful ",no attempts to climb,aw,0,0,0,0,0,frc1540,frc1425,frc4061,166,193,frc3826,frc957,frc3674,blue,48,Yes,Yes,Yes,9,57,1,0,0,24,DeepCage,DeepCage,None,0,0,0,0,0,0,2,5,0,34,104,136,193,0,0,8,1,7
2025pncmp_qm46,qm,1,46,frc7034,0,2,0,0,0,0,0,0,0,3,2,1,1,0,Deep Climb,3,had a three coal auto that worked well,efficient cycling but coal placement accuracy was questionable,their deep climb is a little slow,naman,0,0,1,0,0,frc7034,frc9023,frc360,207,189,frc2471,frc2522,frc9442,red,35,Yes,Yes,Yes,9,44,1,1,1,16,Parked,DeepCage,Parked,0,12,0,0,0,0,4,6,0,35,107,151,207,2,0,28,1,5
2025pncmp_qm46,qm,1,46,frc2471,0,3,0,0,0,0,4,1,2,0,6,0,1,0,Deep Climb,0,"A stopped, no coral score","struggling with L1, kinda accurate, ok with algae",easy deep cage,Cayden,0,0,1,0,0,frc7034,frc9023,frc360,207,189,frc2471,frc2522,frc9442,red,35,Yes,Yes,Yes,9,44,1,1,1,16,Parked,DeepCage,Parked,0,12,0,0,0,0,4,6,0,35,107,151,207,2,0,28,1,5
2025pncmp_qm46,qm,1,46,frc2522,0,4,0,0,0,0,0,0,0,2,5,5,4,0,Deep Climb,2,missed a coral could have gotten 3,they had very fast cycles because of ground collect and fast placing. the one issue is that they had to be very precise for ground collect which could give them some difficulties if the coral position is unfavorable or there is good defense,they were able to climb in decent time under 10-12 seconds,Hendrix Day,0,0,1,0,0,frc7034,frc9023,frc360,207,189,frc2471,frc2522,frc9442,red,35,Yes,Yes,Yes,9,44,1,1,1,16,Parked,DeepCage,Parked,0,12,0,0,0,0,4,6,0,35,107,151,207,2,0,28,1,5
2025pncmp_qm46,qm,1,46,frc9442,0,2,0,0,0,0,4,2,0,5,4,1,0,0,None,2,"got two coral on l4, missed the third though","Placed 10 coral in total, was kind of aimless in driving, and missed some coral, highly unreliable in algae barge, but can remove well","didn't park in time, cannot climb.",Dev Sharma,0,0,1,0,0,frc7034,frc9023,frc360,207,189,frc2471,frc2522,frc9442,red,21,Yes,Yes,Yes,9,30,0,1,1,2,None,None,Parked,0,0,0,0,0,0,4,2,2,35,123,159,189,3,0,34,1,3
2025pncmp_qm46,qm,1,46,frc9023,0,3,0,0,0,0,0,0,0,3,5,5,1,0,None,0,About to place preloaded on L4 but didn't,"Ran really good, fast cycles. Accurate place and ground collect on almost all levels, Speedy as well",Tried running more cycles in endgame,Pranav,0,0,1,0,0,frc7034,frc9023,frc360,207,189,frc2471,frc2522,frc9442,red,21,Yes,Yes,Yes,9,30,0,1,1,2,None,None,Parked,0,0,0,0,0,0,4,2,2,35,123,159,189,3,0,34,1,3
2025pncmp_qm46,qm,1,46,frc360,0,4,0,0,0,0,2,0,3,1,3,2,0,0,Park,1,didn't do very well over all,"Had a little trouble in taking coral, slow, innacurate",started with 5 seconds left but ran out of time while lining up ,aw,0,0,1,0,0,frc7034,frc9023,frc360,207,189,frc2471,frc2522,frc9442,red,21,Yes,Yes,Yes,9,30,0,1,1,2,None,None,Parked,0,0,0,0,0,0,4,2,2,35,123,159,189,3,0,34,1,3
2025pncmp_qm47,qm,1,47,frc2930,0,4,0,0,0,0,0,0,2,4,4,1,3,0,Deep Climb,3,3 coral successful auto,they are really fast and accurate. They kinda carried,really fast deep climb,Aarush,0,0,1,0,0,frc2930,frc2046,frc4469,147,225,frc2976,frc10416,frc4513,blue,31,Yes,Yes,Yes,9,40,0,1,1,4,Parked,None,Parked,0,0,0,0,0,0,2,2,0,25,77,107,147,3,0,26,1,5
2025pncmp_qm47,qm,1,47,frc2976,0,4,0,0,0,0,1,0,0,2,0,2,0,0,None,1,May not have actually scored that one L4. I mightve missed it.,Tended to run into partners a lot. Attempted to score L1 three or four times and always failed.,Ran out of time and wound up not scoring when match ended,Sam,0,0,1,0,0,frc2930,frc2046,frc4469,147,225,frc2976,frc10416,frc4513,blue,31,Yes,Yes,Yes,9,40,0,1,1,4,Parked,None,Parked,0,0,0,0,0,0,2,2,0,25,77,107,147,3,0,26,1,5
2025pncmp_qm47,qm,1,47,frc10416,0,3,0,0,0,0,1,0,0,1,3,0,0,0,Park,0,"Moved forward, and missed coral place, didn't do anything else.","Scored one coral on l4, somewhat barely, and 3 coral on l3, as well as removing one algae. For most of the match, they tried to ground collect coral, and wasn't quite working, even tried station collect and didn't work. Highly unreliable robot, definitely do not recommend.","Just parked, didn't try to climb, barely made it anyway.",Dev Sharma,0,0,1,0,0,frc2930,frc2046,frc4469,147,225,frc2976,frc10416,frc4513,blue,31,Yes,Yes,Yes,9,40,0,1,1,4,Parked,None,Parked,0,0,0,0,0,0,2,2,0,25,77,107,147,3,0,26,1,5
2025pncmp_qm47,qm,1,47,frc4513,0,4,0,0,0,0,1,0,0,4,3,5,1,0,Deep Climb,0,their auto broke they missed anid then they could not station collect ,"they were a very good coral bot could move fast and place very fast. Their cycles could be really fast if they station collected correctly, but could be slowed down if it they did not line up right. Had a weak alage game and had difficulty removing the alage from the reef (2 tries). Pretty consistent overall",they had a good and quick climb.,Hendrix Day,0,0,1,0,0,frc2930,frc2046,frc4469,147,225,frc2976,frc10416,frc4513,blue,28,Yes,Yes,Yes,9,37,1,1,1,24,DeepCage,DeepCage,None,0,0,0,0,0,0,4,6,0,42,136,188,225,2,0,28,1,4
2025pncmp_qm47,qm,1,47,frc2046,0,2,0,0,0,0,2,0,3,3,4,4,4,0,Deep Climb,3,"they placed all 3 well, 3.5 coral auto","very fast all around, very accurate with coral placing ",easy deep cage,cayden,0,0,1,0,0,frc2930,frc2046,frc4469,147,225,frc2976,frc10416,frc4513,blue,28,Yes,Yes,Yes,9,37,1,1,1,24,DeepCage,DeepCage,None,0,0,0,0,0,0,4,6,0,42,136,188,225,2,0,28,1,4
2025pncmp_qm47,qm,1,47,frc4469,0,3,0,0,0,0,1,1,0,2,3,2,0,0,Shallow Climb,1,"slow, takes a ehile","can take off and put on same time, inacurate",didn't take a long time,A,0,0,1,0,0,frc2930,frc2046,frc4469,147,225,frc2976,frc10416,frc4513,blue,28,Yes,Yes,Yes,9,37,1,1,1,24,DeepCage,DeepCage,None,0,0,0,0,0,0,4,6,0,42,136,188,225,2,0,28,1,4
2025pncmp_qm48,qm,1,48,frc1778,0,1,0,0,0,0,4,4,0,5,5,5,5,0,Park,2,"they are really fast, but their auto was a little slow, they didn't have enough time to score the 3rd","very fast and reliable at everything, they placed two coral too fast, one bounced out, and the other almost did",parked last minute,Aarush V,0,0,0,0,0,frc1778,frc4915,frc9446,201,190,frc9567,frc10079,frc3218,red,38,Yes,Yes,Yes,9,47,0,1,1,8,Parked,ShallowCage,None,0,0,0,0,0,0,6,5,0,35,110,154,201,2,0,36,1,6
2025pncmp_qm48,qm,1,48,frc9567,0,3,0,1,1,0,0,0,2,0,0,0,0,0,Park,0,Nothing special to be noted. Auto seems like it would be pretty consistent as it is so simple.,Scored algae in processor but then shifted to defense later. Defense was somewhat effective.,Park only,Sam,0,0,1,0,0,frc1778,frc4915,frc9446,201,190,frc9567,frc10079,frc3218,red,38,Yes,Yes,Yes,9,47,0,1,1,8,Parked,ShallowCage,None,0,0,0,0,0,0,6,5,0,35,110,154,201,2,0,36,1,6
2025pncmp_qm48,qm,1,48,frc10079,0,4,0,0,0,0,1,0,0,3,4,2,0,0,None,3,"Auto was actually pretty good, got a 3 coral auto on l4, and seemed pretty reliable.","Ran coral cycles as well as removing one algae, can't do it reliably and well though, but places on l4 relatively well, including l3 and l2. ","Didn't climb or park, as they were still placing coral, can really only place coral and can't do anything else.",Dev Sharma,0,0,1,0,0,frc1778,frc4915,frc9446,201,190,frc9567,frc10079,frc3218,red,38,Yes,Yes,Yes,9,47,0,1,1,8,Parked,ShallowCage,None,0,0,0,0,0,0,6,5,0,35,110,154,201,2,0,36,1,6
2025pncmp_qm48,qm,1,48,frc3218,0,4,1,0,0,0,0,0,1,0,4,1,0,0,Deep Climb,2,"was able to score twice and then remove an alage, not volatile",they were a good coral and alage bot. They were decent at scoring and collecting coral (ground collect). For alage could only do processor so the time would probally better spent on coral.,scary climb like last time they climbed then dropped then climbed again,Hendrix Day,0,0,1,0,0,frc1778,frc4915,frc9446,201,190,frc9567,frc10079,frc3218,red,35,Yes,Yes,Yes,9,44,1,1,1,26,DeepCage,DeepCage,Parked,0,0,0,0,0,0,2,3,0,28,94,146,190,3,0,26,1,5
2025pncmp_qm48,qm,1,48,frc4915,0,2,0,0,0,0,2,0,0,7,3,0,0,0,Park,3,"placed all 3 well, ","pretty fast coral cycles, focused on coral, ","park, had time to climb but no climb",cayden,0,0,1,0,0,frc1778,frc4915,frc9446,201,190,frc9567,frc10079,frc3218,red,35,Yes,Yes,Yes,9,44,1,1,1,26,DeepCage,DeepCage,Parked,0,0,0,0,0,0,2,3,0,28,94,146,190,3,0,26,1,5
2025pncmp_qm48,qm,1,48,frc9446,0,3,0,0,0,0,0,0,0,0,4,4,0,0,Park,0,"left, didn't attempt anything else","CorAl placement l2 consistent, slower at l3 and more inconsistent. Kinda slow overall","Seemed indecisive about coral VS park, but parked",Olivia ,0,0,1,0,0,frc1778,frc4915,frc9446,201,190,frc9567,frc10079,frc3218,red,35,Yes,Yes,Yes,9,44,1,1,1,26,DeepCage,DeepCage,Parked,0,0,0,0,0,0,2,3,0,28,94,146,190,3,0,26,1,5
2025pncmp_qm49,qm,1,49,frc4131,0,3,0,1,0,11,0,0,6,0,0,0,0,0,None,0,1 on l1 then a stop,Fast but only able to score in l1 and processor. ,"With 40 sec left, the defender ramed into it and broke one of their swerves, stopping them from climbing and scoring processor ",Aarush V,0,0,1,0,0,frc4131,frc5937,frc997,194,208,frc955,frc3636,frc1318,blue,24,Yes,Yes,No,6,30,0,1,1,2,None,Parked,None,0,0,0,0,0,0,4,1,0,30,110,164,194,6,0,52,0,4
2025pncmp_qm49,qm,1,49,frc955,0,2,0,0,0,0,0,0,0,4,4,5,0,0,Park,3,Fast 3 coral auto,"Really solid scoring on L2, 3 and 4. Pretty much never missed.",Park at last second,Sam,0,0,0,0,0,frc4131,frc5937,frc997,194,208,frc955,frc3636,frc1318,blue,24,Yes,Yes,No,6,30,0,1,1,2,None,Parked,None,0,0,0,0,0,0,4,1,0,30,110,164,194,6,0,52,0,4
2025pncmp_qm49,qm,1,49,frc3636,0,4,0,0,0,0,3,2,0,6,6,1,0,0,None,0,"Was frozen, didn't move this time during auto for some reason","Had pretty good and fast coral cycles, had a total of 13, 6 on l4, 6 on l3, and 1 on l2, but even better with the algae, as they removed 3 algae, and  put 2 algae in the net, honestly really good and consistent with putting algae in the net.","Didn't climb or park, cannot climb and was still placing coral.",Dev Sharma,0,0,0,0,0,frc4131,frc5937,frc997,194,208,frc955,frc3636,frc1318,blue,24,Yes,Yes,No,6,30,0,1,1,2,None,Parked,None,0,0,0,0,0,0,4,1,0,30,110,164,194,6,0,52,0,4
2025pncmp_qm49,qm,1,49,frc1318,0,2,0,0,0,0,2,0,0,7,6,2,0,0,Deep Climb,2,They get 2 in but finish auto with a coral loaded,"they were a very good coral bot with fast cycles 6-8 seconds on near side. They were able to place all levels, but l1 was not as good. They were able to collect and place fast. some cycles it took them longer to line up their robot. They were able to remove alage when reaching up to score coral",good climb but it was a little slow to raise up. around 12 seconds to climb,Hendrix Day,0,0,1,0,0,frc4131,frc5937,frc997,194,208,frc955,frc3636,frc1318,blue,14,Yes,Yes,Yes,9,23,1,1,1,14,DeepCage,Parked,None,0,0,0,0,0,0,11,6,0,30,115,185,208,2,0,56,1,2
2025pncmp_qm49,qm,1,49,frc5937,0,3,2,0,0,0,1,3,2,0,0,0,0,0,Park,0,"fast 2 algae barge auto, accurate ","algae only, very good at barge and processing ","park, no attempted to climb",cayden,0,0,0,2,0,frc4131,frc5937,frc997,194,208,frc955,frc3636,frc1318,blue,14,Yes,Yes,Yes,9,23,1,1,1,14,DeepCage,Parked,None,0,0,0,0,0,0,11,6,0,30,115,185,208,2,0,56,1,2
2025pncmp_qm49,qm,1,49,frc997,0,5,0,0,0,0,0,0,0,3,4,5,0,0,None,0,Did not attempt anything except going forward,"quite consistent, missed twiceish, a bit slow on lining up to place But overall good",did not attempt to climb or even park but instead continued to place coral,aw,0,0,1,0,0,frc4131,frc5937,frc997,194,208,frc955,frc3636,frc1318,blue,14,Yes,Yes,Yes,9,23,1,1,1,14,DeepCage,Parked,None,0,0,0,0,0,0,11,6,0,30,115,185,208,2,0,56,1,2
2025pncmp_qm5,qm,1,5,frc4061,0,2,0,0,0,0,0,0,0,0,5,3,2,0,Park,0,just left start zone and got in position to score l2 but didn't actually eject coral,extremely efficient coral placement cycles.,parked at the last moment,naman,0,0,1,0,0,frc4061,frc2147,frc2471,154,134,frc5937,frc4513,frc4125,red,17,Yes,Yes,Yes,9,26,1,1,1,16,Parked,DeepCage,Parked,0,0,0,0,0,0,7,6,0,22,72,128,154,2,0,40,1,3
2025pncmp_qm5,qm,1,5,frc5937,0,3,1,0,0,0,2,5,2,0,0,0,0,0,Deep Climb,0,"removed algea and scored net quickly, then a stoped","very good algea bot, unaware about their ability to place coral, they amazing at net",took 25 secs to barely off the ground,Aarush V,0,0,1,1,0,frc4061,frc2147,frc2471,154,134,frc5937,frc4513,frc4125,red,17,Yes,Yes,Yes,9,26,1,1,1,16,Parked,DeepCage,Parked,0,0,0,0,0,0,7,6,0,22,72,128,154,2,0,40,1,3
2025pncmp_qm5,qm,1,5,frc4513,0,4,0,0,0,0,1,0,0,5,0,3,1,0,Park,2,"Auto was good, placed one coral on l4, collected from station, and placed another one.","Cycled coral, collected from station, and placed coral on l4, l2, and one coral on l1. l4-l2 placing was good and quick, but l1 placing was unreliable and missed 4 times. Removed one algae as well.","Tried to deep climb, but took a long time positioning and ended up parking. Something seemed to snap when it attempted to climb the first time.",Dev Sharma,0,0,1,0,0,frc4061,frc2147,frc2471,154,134,frc5937,frc4513,frc4125,red,17,Yes,Yes,Yes,9,26,1,1,1,16,Parked,DeepCage,Parked,0,0,0,0,0,0,7,6,0,22,72,128,154,2,0,40,1,3
2025pncmp_qm5,qm,1,5,frc4125,0,1,0,0,0,0,0,1,2,0,0,0,0,0,None,0,"just left, maybe A stopped ","not fully accurate with algae, missed 2",not enough time to get parked or climbed ,cayden,0,0,1,0,0,frc4061,frc2147,frc2471,154,134,frc5937,frc4513,frc4125,red,6,Yes,Yes,Yes,9,15,1,0,0,14,None,DeepCage,Parked,0,0,0,0,0,0,7,2,0,16,71,119,134,1,0,34,1,2
2025pncmp_qm5,qm,1,5,frc2147,0,3,1,0,0,0,0,0,0,7,0,2,0,0,Deep Climb,0,Missed a Coral and alage attepted to score on L4 and in the barge.,"they were a good Coral robot. Smooth station collect, 8-10 second cycle while no other robot's or objects in the way. But will  be slowed down if their is stuff in the way. Missed one coral",Good deep climb. Took less than 8 seconds to climb. Not to long to line it up with cage.,Hendrix Day,0,0,1,0,0,frc4061,frc2147,frc2471,154,134,frc5937,frc4513,frc4125,red,6,Yes,Yes,Yes,9,15,1,0,0,14,None,DeepCage,Parked,0,0,0,0,0,0,7,2,0,16,71,119,134,1,0,34,1,2
2025pncmp_qm5,qm,1,5,frc2471,0,5,1,0,0,0,3,4,0,0,4,0,0,0,Park,0,missed 2 shots during auto...bad.,"coral scoring consistent but slow, with pauses. Seem a bit lost sometimes, esp when picking up algae from gtound","tried to climb over and over again, cage was still, but weren't able to.",oliv and anvi,0,0,1,0,0,frc4061,frc2147,frc2471,154,134,frc5937,frc4513,frc4125,red,6,Yes,Yes,Yes,9,15,1,0,0,14,None,DeepCage,Parked,0,0,0,0,0,0,7,2,0,16,71,119,134,1,0,34,1,2
2025pncmp_qm50,qm,1,50,frc2412,0,5,0,1,0,0,0,0,0,4,4,3,0,0,Deep Climb,0,"tried for one l4, but they missed","they are really fast and they have a really fast robot but, they need to work on strategy and climbing faster",almost didn't get off the ground but did less than a second before,Aarush,0,0,1,0,0,frc2412,frc3574,frc4512,195,113,frc9450,frc492,frc6443,red,23,Yes,Yes,Yes,9,32,1,0,1,24,DeepCage,DeepCage,None,0,8,0,0,0,0,4,6,0,33,115,155,195,0,0,16,1,4
2025pncmp_qm50,qm,1,50,frc9450,0,1,1,0,0,0,0,4,0,1,3,2,2,1,Deep Climb,1,Missed first L4,"Really fast net scoring. Also good all rounder for coral, seemed to avoid L4 in teleop though",Climbed without rush. They did still had a coral in the grabber when they climbed.,Sam,0,0,1,0,0,frc2412,frc3574,frc4512,195,113,frc9450,frc492,frc6443,red,23,Yes,Yes,Yes,9,32,1,0,1,24,DeepCage,DeepCage,None,0,8,0,0,0,0,4,6,0,33,115,155,195,0,0,16,1,4
2025pncmp_qm50,qm,1,50,frc492,0,3,0,0,0,0,0,0,0,5,2,0,0,0,None,0,"Left, and tried to place a coral, collect and place on l4, but missed both.","Cycled 7 coral, placing was slow and wobbly, so was station collect, but l4 and l3 placing was okay.",Was still trying to place more coral.,Dev Sharma,0,0,1,0,0,frc2412,frc3574,frc4512,195,113,frc9450,frc492,frc6443,red,23,Yes,Yes,Yes,9,32,1,0,1,24,DeepCage,DeepCage,None,0,8,0,0,0,0,4,6,0,33,115,155,195,0,0,16,1,4
2025pncmp_qm50,qm,1,50,frc6443,0,2,0,0,1,0,0,0,0,1,0,0,0,0,Deep Climb,0,their auto was underwhelming just enough to help secure the ranking point.,they struggled this match they only scored once then something broke and made it so they could not collect coral. After this they played a little defense but for less than 20 seconds so had a small impact,they were able to climb pretty fast in 8-10,Hendrix Day,0,1,1,0,0,frc2412,frc3574,frc4512,195,113,frc9450,frc492,frc6443,red,28,Yes,Yes,Yes,9,37,1,0,0,24,DeepCage,DeepCage,None,1,0,0,0,0,0,1,2,1,18,48,76,113,0,0,4,1,4
2025pncmp_qm50,qm,1,50,frc3574,0,3,0,0,0,0,0,0,0,0,0,0,5,0,Deep Climb,0,just leave no coral score,"very unreliable, takes way to long to collect at the station, very inaccurate aswell, missed alot of L1",deep cage takes time,cayden,0,0,1,0,0,frc2412,frc3574,frc4512,195,113,frc9450,frc492,frc6443,red,28,Yes,Yes,Yes,9,37,1,0,0,24,DeepCage,DeepCage,None,1,0,0,0,0,0,1,2,1,18,48,76,113,0,0,4,1,4
2025pncmp_qm50,qm,1,50,frc4512,0,5,0,0,0,0,2,1,0,4,4,1,0,0,None,3,"quite good, quick","doing okay got stuck on algae well doing barge, may have issues with keeping algae within its grasp, threw an algae outside, had only a couple misses ",waited till last second and therefor didn't make it,aw,0,7,1,0,0,frc2412,frc3574,frc4512,195,113,frc9450,frc492,frc6443,red,28,Yes,Yes,Yes,9,37,1,0,0,24,DeepCage,DeepCage,None,1,0,0,0,0,0,1,2,1,18,48,76,113,0,0,4,1,4
2025pncmp_qm51,qm,1,51,frc4450,0,3,2,0,0,0,2,1,0,0,4,2,0,0,Deep Climb,1,"1 l4, and 2 net, with 100%","they are really good at algae, but not as good at coral, as they missed one","they spent a full minute to climb, and they still barely made it",Aarush V,0,0,1,2,0,frc4450,frc1425,frc2557,232,225,frc2910,frc4061,frc488,red,39,Yes,Yes,Yes,9,48,1,1,1,26,DeepCage,DeepCage,Parked,0,0,0,0,0,0,9,6,0,35,110,184,232,2,0,48,1,6
