Match #,Robot,Team #,Mobility,aL4,aL3,aL2,aL1,aProcessor,aNet,tL4,tL3,tL2,tL1,tProcessor,tNet,Disabled,Deep,Shallow,Park,Algae Removal,Offense,Defense,Accuracy,Comments,Mistake box,Index,"Team, index",Match index,Disable,Mobility,Deep,Shallow,Park,Removal,Offense,Defense,Accuracy
63,B1,2630,TRUE,0,0,0,0,0,0,0,2,0,1,0,4,FALSE,TRUE,FALSE,FALSE,FALSE,x,x,2,"Very fast, and can handle both game modes pieces, but is dragged down by low accuracy. Missed all 3 of its auto cycles",,5,"2630,5","63,B1",0,1,1,0,0,0,x,x,2
63,B2,1796,TRUE,3,0,0,0,0,0,4,5,3,0,1,0,FALSE,TRUE,FALSE,FALSE,TRUE,3,x,3,"Fast cycle time, quickly intakes from station, reliable for speedy reef filling and algae removal. Overall: very balanced robot, very speedy.",,6,"1796,6","63,B2",0,1,1,0,0,1,3,x,3
63,B3,6424,TRUE,1,0,0,0,1,0,4,2,5,2,1,0,FALSE,TRUE,FALSE,FALSE,TRUE,3,x,3,"Decent cycles, just didnt miss. Can score anything anywhere. Medium movement speed.",,6,"6424,6","63,B3",0,1,1,0,0,1,3,x,3
63,R1,3173,TRUE,3,0,0,0,0,0,3,6,4,4,0,1,FALSE,TRUE,FALSE,FALSE,TRUE,3,x,3,"Doing well in auto, can work on both algae and coral. Can hold algae well. Can work on all level coral, and aiming fast have high accuracy. Climb fast and successfully.",,5,"3173,5","63,R1",0,1,1,0,0,1,3,x,3
63,R2,1425,TRUE,0,0,0,0,0,0,3,2,1,2,1,0,FALSE,TRUE,FALSE,FALSE,TRUE,3,x,2,Climbs very high,,5,"1425,5","63,R2",0,1,1,0,0,1,3,x,2
63,R3,8575,TRUE,0,1,0,0,0,0,0,4,5,0,1,0,FALSE,FALSE,FALSE,TRUE,TRUE,x,x,2,"Very slow but consistent, difficult intake , coral can easily get into the drivebase.",,6,"8575,6","63,R3",0,1,0,0,1,1,x,x,2
64,B1,4786,TRUE,3,0,0,0,0,0,3,1,1,1,2,1,FALSE,TRUE,FALSE,FALSE,FALSE,x,x,2,"Can score in every part of the game, but is hampered by accuracy. Much faster during auto than in teleop. Popped an algae",,6,"4786,6","64,B1",0,1,1,0,0,0,x,x,2
64,B2,4451,TRUE,1,0,0,0,0,0,4,6,3,1,0,2,FALSE,TRUE,FALSE,FALSE,TRUE,3,x,3,"Great robot- fast cycle times, good accuracy, reliable for L3 and L2 scoring. Some L1 capability, but wasn't really demonstrated that much. Did accidentally pop an algae",,7,"4451,7","64,B2",0,1,1,0,0,1,3,x,3
64,B3,6832,TRUE,0,0,0,1,0,0,0,0,0,0,0,0,FALSE,FALSE,FALSE,TRUE,FALSE,x,1,x,"Kit bot!!! Way too light for defense. Only L1. No climb. Maybe algae but I dont think so. If so, only processor.",,6,"6832,6","64,B3",0,1,0,0,1,0,x,1,x
64,R1,9280,TRUE,1,0,0,0,0,0,5,3,0,0,0,0,FALSE,FALSE,FALSE,TRUE,FALSE,2,x,2,"Can work on L3 and L4, but have more miss in L4. Didnt try to climb, not sure if it be able to climb.",,6,"9280,6","64,R1",0,1,0,0,1,0,2,x,2
64,R2,2438,TRUE,0,0,0,0,0,0,0,3,2,0,2,0,FALSE,FALSE,FALSE,FALSE,TRUE,2,x,2,Efficient algae claw but intake only takes in coral 3/4 times,,6,"2438,6","64,R2",0,1,0,0,0,1,2,x,2
64,R3,3255,TRUE,1,0,0,0,0,0,6,3,0,0,0,3,FALSE,TRUE,FALSE,FALSE,TRUE,x,x,2,"Large intake that will unlikely fail, quick deep climb, can hold alge and coral at the a same time",,6,"3255,6","64,R3",0,1,1,0,0,1,x,x,2
65,B1,3297,TRUE,1,0,0,0,0,1,2,2,2,0,2,1,FALSE,TRUE,FALSE,FALSE,FALSE,x,x,2,"Somewhat slow, and inaccurate, but well rounded in scoring abilities. Auto cycles take a long time scored processor for other alliance",,6,"3297,6","65,B1",0,1,1,0,0,0,x,x,2
65,B2,226,TRUE,3,0,0,0,0,0,2,3,2,2,0,1,FALSE,FALSE,FALSE,TRUE,TRUE,3,x,3,"Helpful to their team, worked a great strategy by reliably scoring lower levels while other robots scored higher, quick cycle times and smooth aiming.",,6,"226,6","65,B2",0,1,0,0,1,1,3,x,3
65,B3,4421,TRUE,2,0,0,0,0,0,1,3,3,2,1,0,FALSE,TRUE,FALSE,FALSE,TRUE,2,x,1,"Missed many L2,3,4s that landed on L1. Ok cycles. Ok movement. Not great against defense.",,6,"4421,6","65,B3",0,1,1,0,0,1,2,x,1
65,R1,4013,TRUE,0,0,0,0,0,0,0,0,0,0,1,0,FALSE,FALSE,FALSE,TRUE,FALSE,x,2,x,"Takes time on getting algae and might not success. Coral intake not working well. Play defense in 35 seconds before end, doing fine. Didnt climb.",,6,"4013,6","65,R1",0,1,0,0,1,0,x,2,x
65,R2,649,TRUE,0,0,0,0,0,0,8,1,0,1,0,0,FALSE,FALSE,FALSE,TRUE,FALSE,3,x,2,Arm scores very quickly,,6,"649,6","65,R2",0,1,0,0,1,0,3,x,2
65,R3,3256,TRUE,0,0,0,0,0,0,4,5,2,0,0,0,FALSE,FALSE,FALSE,TRUE,TRUE,x,x,2,"Fast intake, quick cycle time, has deep climb but couldnt line up",,6,"3256,6","65,R3",0,1,0,0,1,1,x,x,2
66,B1,1731,TRUE,1,0,0,0,0,0,2,3,3,0,3,1,FALSE,TRUE,FALSE,FALSE,FALSE,x,x,3,"Has a very accurate end effector, but is very slow to cycle, and line up to reef. Very disappointing auto",,6,"1731,6","66,B1",0,1,1,0,0,0,x,x,3
66,B2,1833,TRUE,4,0,0,0,0,0,1,2,6,4,0,0,FALSE,TRUE,FALSE,FALSE,FALSE,3,x,3,"Very compatible for teams that score on higher levels due to lack of an ability to score on L4. Works very quickly, intakes fast, good L1 capability. Tiny bit unstable, only when fully extended",,6,"1833,6","66,B2",0,1,1,0,0,0,3,x,3
66,B3,900,TRUE,1,0,0,1,0,0,3,6,1,0,0,0,FALSE,FALSE,FALSE,TRUE,FALSE,2,x,1,MISSED WAY TOO MANY!!!!! Probably could have scored about 20-25 coral if hadnt missed. Fast cycles but tries to go too fast and misses. No algae or ground intake.,,6,"900,6","66,B3",0,1,0,0,1,0,2,x,1
66,R1,7034,TRUE,3,0,0,0,0,0,1,2,4,1,0,0,FALSE,TRUE,FALSE,FALSE,TRUE,x,x,2,"Doing well in auto. Work on coral and algae removal, have higher accuracy. Climb successfully.",,6,"7034,6","66,R1",0,1,1,0,0,1,x,x,2
66,R2,7525,TRUE,3,0,0,0,0,0,1,6,6,0,0,0,FALSE,FALSE,FALSE,TRUE,FALSE,3,x,3,No algae removal system,,6,"7525,6","66,R2",0,1,0,0,1,0,3,x,3
66,R3,7257,TRUE,0,0,0,0,0,0,4,4,3,0,0,0,FALSE,TRUE,FALSE,FALSE,TRUE,x,x,3,"Auto dont work, very consistent scoring, deep climb",,6,"7257,6","66,R3",0,1,1,0,0,1,x,x,3
67,B1,5968,TRUE,1,0,0,0,0,0,0,0,0,0,0,0,TRUE,FALSE,FALSE,TRUE,FALSE,x,x,x,Robot did auto then disabled then came back to life t- 20,,6,"5968,6","66,B1",1,1,0,0,1,0,x,x,x
67,B2,3891,TRUE,0,0,0,1,0,0,0,0,2,0,0,0,FALSE,FALSE,FALSE,TRUE,FALSE,1,2,2,"Auto was supposed to be two L4 but the first one fell to L1 and the second didnt make it. Very inconsistent in what they wanted to do: played defense for 30 seconds, went back to offense for 30 seconds and then the rest of the time did defense",,6,"3891,6","67,B2",0,1,0,0,1,0,1,2,2
67,B3,4500,TRUE,2,0,0,0,0,0,3,7,3,0,0,0,FALSE,TRUE,FALSE,FALSE,TRUE,3,x,2,"Kinda did all the work for the team. Indecisiveness slowed down cycle time by a lot, but other than that smooth and fast cycles. Good auto, worked perfectly",,6,"4500,6","67,B3",0,1,1,0,0,1,3,x,2
67,R1,1678,TRUE,4,0,0,0,0,0,0,1,1,0,4,3,FALSE,TRUE,FALSE,FALSE,TRUE,3,x,2,sucessful auto.scored in other teams processor for coopertition. struggled a bit with the processor.,,6,"1678,6","67,R1",0,1,1,0,0,1,3,x,2
67,R2,6146,TRUE,0,0,0,0,0,0,1,1,2,0,0,0,FALSE,TRUE,FALSE,FALSE,TRUE,2,x,2,Struggled to intake for a while. Slow elevator. Slow at aligning for climb,,6,"6146,6",#REF!,0,1,1,0,0,1,2,x,2
67,R3,8738,TRUE,3,0,0,0,0,0,3,5,4,0,0,0,FALSE,FALSE,FALSE,FALSE,FALSE,2,x,2,"Had a lot of trouble intaking coral, missed an l1 shot, tried to score in net but algae fell off",,6,"8738,6","67,R3",0,1,0,0,0,0,2,x,2
68,B1,4655,TRUE,3,0,0,0,0,0,1,5,5,0,1,1,FALSE,TRUE,FALSE,FALSE,TRUE,2,x,2,They have good barge but they have to grab it just right for scoring can do all levels,,6,"4655,6","68,B1",0,1,1,0,0,1,2,x,2
68,B2,302,TRUE,3,0,0,0,0,0,1,3,1,0,1,0,FALSE,TRUE,FALSE,FALSE,TRUE,3,x,3,"Auto was 3.5(ended with a coral inside). Really good and consistent cycles despite there being a defense bot at the coral station. Match was going great until it got on top of an anlgea and didnt move for 30 seconds because it could have tipped over, until another robot helped it.",,6,"302,6","68,B2",0,1,1,0,0,1,3,x,3
68,B3,9032,TRUE,1,0,0,0,0,1,3,4,4,0,0,0,FALSE,FALSE,FALSE,TRUE,TRUE,3,x,3,Can pick up algae off the ground.,,5,"9032,5","68,B3",0,1,0,0,1,1,3,x,3
68,R1,4607,TRUE,2,0,0,0,0,0,6,7,2,0,0,1,FALSE,TRUE,FALSE,FALSE,TRUE,3,x,3,failed 3 coral. pretty good at cycling. removed one algae to score into the net. very fast climb.,,6,"4607,6","68,R1",0,1,1,0,0,1,3,x,3
68,R2,10698,TRUE,0,0,0,0,0,0,1,0,0,0,0,0,FALSE,FALSE,FALSE,TRUE,FALSE,x,2,2,Drove forward in auto. Went to defense after first l4. Mostly just drove back and forth on one coral station. Very slow to align with cage,,6,"10698,6","68,R2",0,1,0,0,1,0,x,2,2
68,R3,1369,TRUE,1,0,0,0,0,0,0,0,0,0,2,4,FALSE,FALSE,FALSE,FALSE,TRUE,2,x,1,"Missed 2 algae in net in auto, missed multiple in net by overshooting or it falling out of robot, algae kept falling out when trying to put in processor",,6,"1369,6","68,R3",0,1,0,0,0,1,2,x,1
69,B1,3284,TRUE,0,0,0,0,0,0,0,0,0,5,2,0,FALSE,FALSE,FALSE,TRUE,TRUE,2,x,3,They focused on algae for the first part which was not very good but then went to L1 and was scorning fast,,6,"3284,6","69,B1",0,1,0,0,1,1,2,x,3
69,B2,8808,TRUE,1,0,0,0,0,0,6,4,1,0,0,0,FALSE,FALSE,FALSE,TRUE,TRUE,3,x,3,Ground intake sometimes slow. Auto also went and knocked over one of the starting algae and coral towers. Removed two algae from reef. Two of the coral went on the reef in a weird way.,,6,"8808,6","69,B2",0,1,0,0,1,1,3,x,3
69,B3,6909,TRUE,0,0,0,0,0,0,0,5,4,0,0,0,FALSE,TRUE,FALSE,FALSE,FALSE,2,x,2,"Auto may not be accurate, got bored and started watching Galileo. Only went for L3 and L2 so it might not be able to get to L4. Auto either didnt work, doesnt do anything, or I missed it doing something. I think it didnt work",,6,"6909,6","69,B3",0,1,1,0,0,0,2,x,2
69,R1,2724,TRUE,0,0,1,0,0,0,0,3,3,0,2,0,FALSE,TRUE,FALSE,FALSE,TRUE,3,x,3,failed 1.5. only removed algae to score in processor. seemd to focus on L2 before L3 for some reason.,,6,"2724,6","69,R1",0,1,1,0,0,1,3,x,3
69,R2,4415,TRUE,1,0,0,0,0,1,2,6,4,1,0,3,FALSE,TRUE,FALSE,FALSE,TRUE,3,x,2,Fast algae. Fast ground intake. Sometimes shot coral into middle of reef,,6,"4415,6","69,R2",0,1,1,0,0,1,3,x,2
69,R3,9199,TRUE,1,0,0,0,0,0,6,2,0,0,0,0,FALSE,TRUE,FALSE,FALSE,FALSE,2,x,2,"Missed intaking coral in auto, didnt drive very fast, cycle time medium speed, almost didnt have power to climb",,6,"9199,6","69,R3",0,1,1,0,0,0,2,x,2
70,B1,4613,TRUE,0,0,0,0,0,2,0,5,6,1,0,4,FALSE,TRUE,FALSE,FALSE,TRUE,3,x,3,Very fast net and L3 cannot go L4,,6,"4613,6","70,B1",0,1,1,0,0,1,3,x,3
70,B2,10260,TRUE,0,0,0,0,0,0,0,0,0,5,0,0,FALSE,FALSE,FALSE,TRUE,FALSE,3,1,3,"Its a kitbot. Auto went and knocked one of the starting towers. Consistent L1 cycles, but then went to play really bad defense.",,6,"10260,6","70,B2",0,1,0,0,1,0,3,1,3
70,B3,2056,TRUE,5,0,0,0,0,0,6,6,6,5,2,2,FALSE,TRUE,FALSE,FALSE,TRUE,3,x,2,"There could be more coral it scored on the trough, but I couldnt see it and/or I didnt think it counted. Anyway, good auto, can remove coral from reef, can pick up coral off ground",,6,"2056,6","70,B3",0,1,1,0,0,1,3,x,2
70,R1,6017,TRUE,0,0,0,0,0,0,0,0,0,0,0,0,FALSE,TRUE,FALSE,FALSE,FALSE,x,2,x,failed 1 coral. robot seemed confused at the start of teleop and then played defense.,,6,"6017,6","70,R1",0,1,1,0,0,0,x,2,x
70,R2,3792,TRUE,0,0,0,3,0,0,0,0,0,4,8,0,FALSE,TRUE,FALSE,FALSE,FALSE,2,x,2,Climb is through middle of robot so cage cannot swing before climb. Fast algae intake. Sometimes the coral falls out a bit before the trough,,6,"3792,6","70,R2",0,1,1,0,0,0,2,x,2
70,R3,6083,TRUE,0,0,1,0,0,0,0,4,7,0,0,0,FALSE,FALSE,FALSE,FALSE,FALSE,2,x,2,"Missed a coral intake during auto, didnt drive very fast, medium cycle time speed",,6,"6083,6","70,R3",0,1,0,0,0,0,2,x,2
71,B1,2630,TRUE,3,0,0,0,0,0,4,4,1,6,0,4,FALSE,TRUE,FALSE,FALSE,TRUE,3,x,3,Very fast net and all levels great climb fast,,6,"2630,6","71,B1",0,1,1,0,0,1,3,x,3
71,B2,10291,TRUE,0,1,0,0,0,0,0,4,6,0,0,0,FALSE,TRUE,FALSE,FALSE,TRUE,3,x,3,Auto also removed an algea but it was supposed to take to the processor but didnt intake it. Consistent cycles.,,6,"10291,6","71,B2",0,1,1,0,0,1,3,x,3
71,B3,6995,TRUE,3,0,0,0,0,0,2,2,5,0,2,1,FALSE,TRUE,FALSE,FALSE,TRUE,3,x,2,"Auto worked great, uses arm for climb. Can pick up coral off the ground.",,6,"6995,6","71,B3",0,1,1,0,0,1,3,x,2
71,R1,3492,TRUE,0,0,0,0,0,0,0,4,4,4,0,0,FALSE,FALSE,FALSE,TRUE,FALSE,3,x,2,failed 1.5 auto. robot drove kind of slow but was still able to cycle pretty well. hardly made it to the parking.,,6,"3492,6","71,R1",0,1,0,0,1,0,3,x,2
71,R2,7197,TRUE,1,0,0,0,0,0,2,5,3,0,2,0,FALSE,FALSE,FALSE,TRUE,TRUE,2,x,2,Fast algae removal. Good at coral and algae. Auto missed second coral because it got stuck in between the end effector and the branch.,,6,"7197,6","71,R2",0,1,0,0,1,1,2,x,2
71,R3,537,TRUE,1,0,0,0,0,0,5,2,1,0,0,0,FALSE,TRUE,FALSE,FALSE,FALSE,2,x,2,"Auto was slow and didnt move after scoring the coral, twice they tried to score coral and it bounced back out, climbed with coral still in robot",,6,"537,6","71,R3",0,1,1,0,0,0,2,x,2
72,B1,1507,TRUE,1,0,0,0,0,0,4,5,2,1,0,2,FALSE,TRUE,FALSE,FALSE,TRUE,2,x,2,They had good all levels just a bit slow make about 80 percent,,6,"1507,6","72,B1",0,1,1,0,0,1,2,x,2
72,B2,3173,TRUE,3,0,0,0,0,0,4,5,2,1,0,2,FALSE,TRUE,FALSE,FALSE,TRUE,3,x,3,Missed in net one time. Missed in L4 once. Consistent and fast cycles,,6,"3173,6","72,B2",0,1,1,0,0,1,3,x,3
72,B3,9312,TRUE,0,0,2,0,0,0,0,0,0,3,0,0,FALSE,FALSE,FALSE,TRUE,FALSE,1,x,1,Only tried to score on L1 and missed a lot. At least from what I saw. Always tried to score on the side of the reef I couldnt see,,6,"9312,6","72,B3",0,1,0,0,1,0,1,x,1
72,R1,179,TRUE,1,1,0,1,0,0,7,2,1,0,0,0,FALSE,TRUE,FALSE,FALSE,FALSE,3,x,2,cleared algae while doing auto. dropped an L4 into L1 during auto.  tried to score in net but failed twice and gave up.,,6,"179,6","72,R1",0,1,1,0,0,0,3,x,2
72,R2,1847,TRUE,1,0,0,0,0,0,2,3,7,0,0,0,FALSE,FALSE,FALSE,TRUE,FALSE,2,x,2,Slow intake. Moves around other alliance partners. Climb is hard to align.,,6,"1847,6","72,R2",0,1,0,0,1,0,2,x,2
72,R3,9484,TRUE,0,0,0,1,0,0,0,4,4,0,0,0,FALSE,FALSE,FALSE,TRUE,TRUE,2,x,2,"Missed l4 in auto, took a while to line up to score auto, drove slow",,5,"9484,5","72,R3",0,1,0,0,1,1,2,x,2
73,B1,4005,TRUE,1,0,0,0,0,0,2,3,2,0,0,0,FALSE,TRUE,FALSE,FALSE,TRUE,2,x,3,"Working on coral, can do L2-L4. Have high accuracy, but takes time on aiming. Climb successfully.",,6,"4005,6","73,B1",0,1,1,0,0,1,2,x,3
73,B2,694,TRUE,3,0,0,0,0,0,2,4,7,0,4,2,FALSE,TRUE,FALSE,FALSE,TRUE,3,x,3,"Incredibly accurate, fast, and efficient",,6,"694,6","73,B2",0,1,1,0,0,1,3,x,3
73,B3,7048,TRUE,0,0,0,0,0,0,3,4,0,0,0,0,FALSE,TRUE,FALSE,FALSE,FALSE,x,x,x,"Can hold algae and coral at the same, very jiggly end effector",,6,"7048,6","73,B3",0,1,1,0,0,0,x,x,x
73,R1,2648,TRUE,1,0,0,1,0,0,3,5,5,0,0,0,FALSE,TRUE,FALSE,FALSE,TRUE,3,x,2,"They missed every once in awhile, but more often than not they were able to score with faster cycles. They could also possibly score net but missed, auto was wobbly and missed 2nd shot.",,6,"2648,6","73,R1",0,1,1,0,0,1,3,x,2
73,R2,2129,TRUE,2,0,0,0,0,0,3,4,3,0,2,0,FALSE,FALSE,FALSE,TRUE,TRUE,2,x,1,Missed coral often Slow cycle time,,6,"2129,6","73,R2",0,1,0,0,1,1,2,x,1
73,R3,4967,TRUE,1,0,0,0,0,0,2,3,3,0,2,1,FALSE,FALSE,FALSE,TRUE,TRUE,2,x,2,"Had decent cycle times and could quickly score algae, attempted to score algae in auto but missed both",,6,"4967,6","73,R3",0,1,0,0,1,1,2,x,2
74,B1,6348,TRUE,0,0,0,0,0,0,1,1,0,1,0,0,FALSE,FALSE,FALSE,TRUE,TRUE,x,x,2,"Can work on both algae and coral, takes time on getting algae and try to put it in the net ( failed). Can work on L3-4 coral. Climb successfully.",,6,"6348,6","74,B1",0,1,0,0,1,1,x,x,2
74,B2,4068,TRUE,3,0,0,0,0,0,2,5,4,0,0,3,FALSE,FALSE,FALSE,TRUE,TRUE,3,x,3,Climb mechanism doesnt always work,,6,"4068,6","74,B2",0,1,0,0,1,1,3,x,3
74,B3,1425,TRUE,3,0,0,0,0,0,3,3,3,0,2,0,FALSE,TRUE,FALSE,FALSE,TRUE,x,x,3,Extremely fast cycle time due to not needing to turn around because their intake/end effector goes through the robot,,6,"1425,6","74,B3",0,1,1,0,0,1,x,x,3
74,R1,9301,TRUE,0,0,0,0,0,0,0,0,0,0,2,0,FALSE,TRUE,FALSE,FALSE,FALSE,1,1,2,Scored some alge in the net and just played def after. The auto missed its one shot. It was slow and didnt play def very well.,,6,"9301,6","74,R1",0,1,1,0,0,0,1,1,2
74,R2,1481,TRUE,1,0,0,0,0,0,4,5,0,0,0,0,FALSE,TRUE,FALSE,FALSE,FALSE,2,x,1,Missed lots of coral auto failed Dropped algae,,6,"1481,6","74,R2",0,1,1,0,0,0,2,x,1
74,R3,418,TRUE,3,0,0,0,0,0,3,3,0,0,0,0,FALSE,TRUE,FALSE,FALSE,TRUE,1,x,1,Had good cycles but had a lot of trouble scoring on L3 and below,,6,"418,6","74,R3",0,1,1,0,0,1,1,x,1
75,B1,1671,TRUE,1,0,0,0,0,0,4,3,4,0,0,0,FALSE,FALSE,FALSE,TRUE,FALSE,x,x,2,Working on coral (L2-4) but have lower accuracy. Didnt try climb.,,6,"1671,6","75,B1",0,1,0,0,1,0,x,x,2
75,B2,6911,TRUE,0,0,0,0,0,2,2,2,1,0,2,5,FALSE,FALSE,FALSE,TRUE,TRUE,3,x,3,Incredible efficient algae claw,,6,"6911,6","75,B2",0,1,0,0,1,1,3,x,3
75,B3,9432,TRUE,3,0,0,0,0,0,2,7,7,0,0,2,FALSE,TRUE,FALSE,FALSE,TRUE,x,x,3,"Pass through intake so faster cycle time, can manipulate algae and coral, deep climb",,5,"9432,5","75,B3",0,1,1,0,0,1,x,x,3
75,R1,78,TRUE,2,0,0,0,0,0,4,4,0,1,0,1,FALSE,TRUE,FALSE,FALSE,TRUE,3,x,2,"Very fast, but very inaccurate. They missed a lot in both auto and teleop. They also hindered their team a lot, being aggressive and getting in the way.",,6,"78,6","75,R1",0,1,1,0,0,1,3,x,2
75,R2,494,TRUE,2,0,0,0,0,0,2,2,3,0,2,1,FALSE,FALSE,FALSE,TRUE,FALSE,2,x,1,Miss lots of coral Miss lots of algae in the net Climb failed Auto failed,,6,"494,6","75,R2",0,1,0,0,1,0,2,x,1
75,R3,5660,TRUE,0,0,0,0,0,0,0,4,4,0,0,4,FALSE,TRUE,FALSE,FALSE,TRUE,3,x,2,Missed attempted scores in auto but had good cycles otherwise,,6,"5660,6","75,R3",0,1,1,0,0,1,3,x,2
76,B1,7525,TRUE,2,0,0,1,0,0,1,6,5,2,0,0,FALSE,FALSE,FALSE,TRUE,FALSE,x,x,2,"Doing fine in auto. Working on coral, can do L2-L4 (L1 are the coral miss in L3), have higher accuracy. Didnt try climb.",,7,"7525,7","76,B1",0,1,0,0,1,0,x,x,2
76,B2,4500,TRUE,3,0,0,0,0,0,2,5,0,4,0,0,FALSE,TRUE,FALSE,FALSE,TRUE,3,x,2,Robot folds up to climb,,7,"4500,7","76,B2",0,1,1,0,0,1,3,x,2
76,B3,9280,TRUE,0,0,0,0,0,0,3,1,0,0,2,0,FALSE,FALSE,FALSE,TRUE,FALSE,x,x,x,"Pass through intake, slow overall speed, auto was broken.",,7,"9280,7","76,B3",0,1,0,0,1,0,x,x,x
76,R1,4421,TRUE,0,0,0,0,0,0,4,4,3,1,0,0,FALSE,TRUE,FALSE,FALSE,FALSE,3,x,2,"L4 is iffy in auto and teleop, but L3 and L2 are consistent. Auto missed a lot.",,7,"4421,7","76,R1",0,1,1,0,0,0,3,x,2
76,R2,9032,TRUE,1,0,0,0,0,1,2,3,2,0,0,2,FALSE,FALSE,FALSE,TRUE,TRUE,2,x,3,Did not miss at all Slow cycle time,,6,"9032,6","76,R2",0,1,0,0,1,1,2,x,3
76,R3,8575,TRUE,0,2,0,0,0,0,0,2,5,2,2,0,FALSE,FALSE,FALSE,TRUE,TRUE,3,x,3,Had fast cycles and was good at scoring on the lower levels,,7,"8575,7","76,R3",0,1,0,0,1,1,3,x,3
77,B1,7257,TRUE,2,0,0,0,0,0,5,6,3,0,0,0,FALSE,TRUE,FALSE,FALSE,FALSE,3,x,3,"Doing fine in auto. Working on coral, sometimes takes time on getting coral. Have high accuracy. Climb fast.",,7,"7257,7","77,B1",0,1,1,0,0,0,3,x,3
77,B2,2724,TRUE,0,0,1,0,0,0,0,4,5,0,0,1,FALSE,TRUE,FALSE,FALSE,TRUE,2,x,3,Looks unable to score on L4. Algae intake doubles as coral funnel,,7,"2724,7","77,B2",0,1,1,0,0,1,2,x,3
77,B3,1369,TRUE,1,0,0,0,0,0,0,0,0,0,2,4,FALSE,FALSE,FALSE,TRUE,FALSE,x,x,1,"Didnt attempt any algae besides during autos, kept over shooting algae",,7,"1369,7","77,B3",0,1,0,0,1,0,x,x,1
77,R1,7034,TRUE,3,0,0,0,0,0,3,4,3,2,0,0,FALSE,FALSE,FALSE,TRUE,FALSE,3,x,3,"Decent speed cycles, but very accurate, auto does a flawless 3 piece L4. Only missed once in teleop on L1.",,7,"7034,7","77,R1",0,1,0,0,1,0,3,x,3
77,R2,8738,TRUE,3,0,0,0,0,0,2,4,1,1,0,1,FALSE,FALSE,FALSE,TRUE,FALSE,2,x,1,"Missed L1, L2, L3, and L4 Algae missed processor every single time",,7,"8738,7","77,R2",0,1,0,0,1,0,2,x,1
77,R3,3256,TRUE,0,0,0,1,0,0,0,3,4,2,0,1,FALSE,FALSE,FALSE,TRUE,TRUE,2,x,2,Missed algae in auto but had good cycles and decent accuracy on the lower levels,,7,"3256,7","77,R3",0,1,0,0,1,1,2,x,2
78,B1,4607,TRUE,1,0,0,0,0,2,3,6,5,0,0,4,FALSE,TRUE,FALSE,FALSE,TRUE,3,x,3,Doing well in auto. Can work on both coral (L2-4) and algae. Do everything smooth and fast. Climb fast.,,7,"4607,7","78,B1",0,1,1,0,0,1,3,x,3
78,B2,4013,TRUE,0,0,0,0,0,0,0,0,0,0,2,0,FALSE,FALSE,FALSE,TRUE,TRUE,2,2,2,Seems better for algae than coral,,7,"4013,7","78,B2",0,1,0,0,1,1,2,2,2
78,B3,4415,TRUE,2,0,0,0,0,0,6,2,4,0,1,0,FALSE,TRUE,FALSE,FALSE,TRUE,x,x,2,"Very fast cycle time, ground intake processor for the other team",,7,"4415,7","78,B3",0,1,1,0,0,1,x,x,2
78,R1,3255,TRUE,2,0,0,0,0,0,5,0,1,0,0,7,FALSE,FALSE,FALSE,TRUE,TRUE,3,x,3,"It was perfect with the alge and net shots, its coral shots were good, but they missed a few times. They also toppled over when climbing.",,7,"3255,7","78,R1",0,1,0,0,1,1,3,x,3
78,R2,10260,TRUE,0,0,0,1,0,0,0,0,0,5,0,0,FALSE,FALSE,FALSE,TRUE,FALSE,1,x,x,Driving is clunky and slow Just a kit bot  They should not have made it this far  Robot will just drag down other teams scores during qualification,,7,"10260,7","78,R2",0,1,0,0,1,0,1,x,x
78,R3,5968,TRUE,1,0,0,0,0,0,2,2,0,0,2,0,FALSE,FALSE,FALSE,TRUE,FALSE,1,x,1,It missed a score in the processor and had extremely slow cycles,,7,"5968,7","78,R3",0,1,0,0,1,0,1,x,1
79,B1,4613,TRUE,0,1,0,0,0,1,0,11,5,1,0,2,FALSE,TRUE,FALSE,FALSE,FALSE,x,x,x,failed 1 coral 2 algae. robot was hindered by its team mates blocking it. focused on filling lower levels of the reef.,,7,"4613,7","79,B1",0,1,1,0,0,0,x,x,x
79,B2,6832,TRUE,0,0,0,0,0,0,0,0,0,2,0,0,TRUE,FALSE,FALSE,FALSE,FALSE,1,x,1,Tank bot. L1 only. too fast and the coral sometimes bounces out of the trough. Got disabled at coral station,,7,"6832,7","79,B2",1,1,0,0,0,0,1,x,1
79,B3,6146,TRUE,0,0,0,1,0,0,7,0,0,1,0,0,FALSE,TRUE,FALSE,FALSE,FALSE,2,x,2,"Elevator/ end effector is very big and hard to maneuver, takes a while to line up for scoring, missed a few l4",,7,"6146,7","79,B3",0,1,1,0,0,0,2,x,2
79,R1,6424,TRUE,3,0,0,0,0,0,6,0,0,0,1,0,FALSE,TRUE,FALSE,FALSE,FALSE,x,x,3,"Very fast during teleop, very efficient cycle, lines up to the reef very quickly. Takes a long to climb, only has a 3 coral auto",,7,"6424,7","79,R1",0,1,1,0,0,0,x,x,3
79,R2,3284,TRUE,0,0,0,0,0,0,0,0,0,16,0,0,FALSE,FALSE,FALSE,TRUE,TRUE,1,x,x,Tried algea but didnt manage to score any in processor or net lost control of the algea when they scored an l1 they described a different t l1,,7,"3284,7","79,R2",0,1,0,0,1,1,1,x,x
79,R3,10291,TRUE,0,0,0,1,0,0,0,7,2,1,1,0,FALSE,TRUE,FALSE,FALSE,TRUE,2,x,3,"Doesnt miss, but has slow movement and elevator. I dont think elevator goes to L4. Can score algae. Ground intake. Very consistent. Ok cycles.",,7,"10291,7","79,R3",0,1,1,0,0,1,2,x,3
80,B1,1507,TRUE,1,0,0,0,0,0,2,2,0,0,0,0,FALSE,TRUE,FALSE,FALSE,TRUE,2,3,2,successful auto. picked up two algae and threw i at the other side to block them. slow cycle but did pretty well at disrupting the other team.,,7,"1507,7","80,B1",0,1,1,0,0,1,2,3,2
80,B2,2630,TRUE,3,0,0,0,0,0,4,4,2,0,0,4,FALSE,TRUE,FALSE,FALSE,TRUE,3,x,3,Fast climb. Very fast cycles. Sometimes the algae will bounce out. Slowest part is in taking at the coral station.,,7,"2630,7","80,B2",0,1,1,0,0,1,3,x,3
80,B3,4451,TRUE,2,0,0,0,0,0,0,7,8,0,0,0,FALSE,FALSE,FALSE,TRUE,FALSE,3,x,3,"Very fast cycle time, drove around fast, didnt get in teammates way, lined up to score very fast",,8,"4451,8","80,B3",0,1,0,0,1,0,3,x,3
80,R1,302,TRUE,1,0,0,0,0,0,3,2,1,0,0,5,FALSE,FALSE,FALSE,TRUE,FALSE,x,x,3,"Very good for high scoring as they focus primarily on the upper levels of the reef, and scoring in the net. Helped teammate get off an algae",,7,"302,7","80,R1",0,1,0,0,1,0,x,x,3
80,R2,1833,TRUE,3,0,0,0,0,0,1,5,9,0,0,0,FALSE,TRUE,FALSE,FALSE,FALSE,3,x,3,"Got beached got off easily when their alliance partner came to help fast l2 cycles. Reliable for L3 scoring, quick cycle times, and good accuracy",,7,"1833,7","80,R2",0,1,1,0,0,0,3,x,3
80,R3,8808,TRUE,1,0,0,0,0,0,2,0,0,0,0,0,FALSE,FALSE,FALSE,TRUE,FALSE,1,2,2,"Very slow ground intake, movement, and elevator. Very finicky outtake. Ok accuracy, but sometimes takes lots of time to aim. Defense is ok but not the best strategy for it. Defended most of game until the very end.",,7,"8808,7","80,R3",0,1,0,0,1,0,1,2,2
81,B1,537,TRUE,1,0,0,0,0,0,3,1,1,0,0,0,FALSE,FALSE,FALSE,TRUE,FALSE,2,x,2,successful auto. robot seemed uncoordinated in the match and was missing shots.,,7,"537,7","81,B1",0,1,0,0,1,0,2,x,2
81,B2,900,TRUE,3,0,0,0,0,0,2,2,7,0,0,0,TRUE,FALSE,FALSE,TRUE,FALSE,3,x,2,Fast cycles. Was disabled for first half. Algae got stuck in between them and coral station during auto.,,7,"900,7","81,B2",1,1,0,0,1,0,3,x,2
81,B3,9199,TRUE,1,0,0,0,0,0,3,2,0,0,0,0,FALSE,FALSE,FALSE,TRUE,TRUE,2,x,2,"Missed a coral intake during auto and missed a coral in auto, took a while for them to knock off some algae,",,7,"9199,7","81,B3",0,1,0,0,1,1,2,x,2
81,R1,10698,TRUE,0,0,0,0,0,0,1,0,0,0,0,0,FALSE,FALSE,FALSE,TRUE,FALSE,x,1,x,"Very slow during both auto and teleop, tried to play defense during teleop, but because of their lack of speed, it didnt do much",,7,"10698,7","81,R1",0,1,0,0,1,0,x,1,x
81,R2,4005,TRUE,1,0,0,0,0,0,5,0,1,0,0,0,FALSE,TRUE,FALSE,FALSE,FALSE,2,x,2,"Not the worst, not the best. Decent at scoring, but cycle times are slow, and a lot of time is wasted when they're trying to aim. Very little difficulty intaking from station",,7,"4005,7","81,R2",0,1,1,0,0,0,2,x,2
81,R3,4786,TRUE,2,0,0,0,0,0,3,6,6,1,0,2,FALSE,FALSE,FALSE,TRUE,TRUE,3,x,3,"Very fast cycles, very consistent, can score anything anywhere, no ground intake.",,7,"4786,7","81,R3",0,1,0,0,1,1,3,x,3
82,B1,3297,TRUE,1,0,0,0,0,0,0,0,0,0,0,2,FALSE,TRUE,FALSE,FALSE,FALSE,x,2,x,successful auto. played defense after autonomous and scoring in the net.,,7,"3297,7","82,B1",0,1,1,0,0,0,x,2,x
82,B2,2648,TRUE,3,0,0,0,0,0,8,1,0,0,0,0,FALSE,FALSE,FALSE,TRUE,TRUE,3,x,2,Fell off cage. Missed all of the algae into the net. Fast coral cycles,,7,"2648,7","82,B2",0,1,0,0,1,1,3,x,2
82,B3,9484,TRUE,0,0,0,0,0,0,0,6,1,0,0,0,FALSE,FALSE,FALSE,TRUE,TRUE,2,x,2,"Got in their teammates way a lot, auto moved a little then didnt do anything, had trouble knocking algae off reef",,6,"9484,6","82,B3",0,1,0,0,1,1,2,x,2
