Match #,Robot,Team #,Mobility,aL4,aL3,aL2,aL1,aProcessor,aNet,tL4,tL3,tL2,tL1,tProcessor,tNet,Disabled,Deep,Shallow,Park,Algae Removal,Offense,Defense,Accuracy,Comments,Mistake box,Index,"Team, index",Match index,Disable,Mobility,Deep,Shallow,Park,Removal,Offense,Defense,Accuracy
42,B2,418,TRUE,2,0,0,0,0,0,3,2,1,0,0,0,FALSE,TRUE,FALSE,FALSE,TRUE,2,x,3,Got on top of algae. Kind of slow cycles,,4,"418,4","42,B2",0,1,1,0,0,1,2,x,3
42,B3,7048,TRUE,1,0,0,0,0,0,4,1,1,0,0,0,FALSE,FALSE,FALSE,TRUE,FALSE,2,x,3,Got stuck in a ball for half the match,,4,"7048,4","42,B3",0,1,0,0,1,0,2,x,3
42,R1,1369,TRUE,1,0,0,0,0,0,1,1,0,2,2,1,FALSE,FALSE,FALSE,TRUE,TRUE,2,x,2,failed 1 coral 1 net auto. failed to park. really struggled to score. removed algae only for net.,,4,"1369,4","42,R1",0,1,0,0,1,1,2,x,2
42,R2,6083,TRUE,1,0,0,0,0,0,0,3,4,1,0,0,FALSE,FALSE,FALSE,FALSE,FALSE,2,x,1,Kept dropping coral when trying to score l3. One l2 dropped into l1. Kind of slow.,,4,"6083,4","42,R2",0,1,0,0,0,0,2,x,1
42,R3,8808,TRUE,0,0,0,0,0,0,6,3,3,0,0,0,FALSE,TRUE,FALSE,FALSE,TRUE,2,x,2,"Tried to score twice in auto missed once couldnt pick up algae other, drove kinda fast",,4,"8808,4","42,R3",0,1,1,0,0,1,2,x,2
43,B1,694,TRUE,3,0,0,0,0,0,0,5,5,5,1,2,FALSE,TRUE,FALSE,FALSE,TRUE,3,x,3,Doing well in auto. Can work on both algae and coral. Can picked them up from ground. But coral picked up from ground can just put on L1. High accuracy. Climb fast and successfully.,,4,"694,4","43,B1",0,1,1,0,0,1,3,x,3
43,B2,3297,TRUE,1,0,0,0,0,1,1,0,3,0,1,0,FALSE,TRUE,FALSE,FALSE,TRUE,2,x,2,Ground intake system,,4,"3297,4","43,B2",0,1,1,0,0,1,2,x,2
43,B3,7034,TRUE,3,0,0,0,0,0,3,5,1,0,0,0,FALSE,TRUE,FALSE,FALSE,FALSE,x,x,2,"Good 3 coral auto, inconsistent intake, slow climb, constant coral placement.",,4,"7034,4","43,B3",0,1,1,0,0,0,x,x,2
43,R1,2438,TRUE,1,0,0,0,0,0,0,0,0,1,1,0,FALSE,FALSE,FALSE,TRUE,TRUE,1,3,1,"Very very very very very bad, made like zero shots except for one auto and one alge. Def was pretty good though.",,4,"2438,4","43,R1",0,1,0,0,1,1,1,3,1
43,R2,4421,TRUE,1,0,0,0,0,1,1,1,3,0,2,0,FALSE,FALSE,FALSE,FALSE,TRUE,2,x,2,Only dropped like two coral  Good algae intake,,4,"4421,4","43,R2",0,1,0,0,0,1,2,x,2
43,R3,537,TRUE,0,0,0,0,0,0,1,2,3,1,0,0,FALSE,FALSE,FALSE,TRUE,FALSE,1,x,1,"Very slow, had trouble in taking and had very questionable accuracy",,4,"537,4","43,R3",0,1,0,0,1,0,1,x,1
44,B1,179,TRUE,2,1,0,0,0,0,5,4,3,1,0,2,FALSE,TRUE,FALSE,FALSE,FALSE,3,x,2,Doing well in auto. Can work on both coral and algae. Can get coral from the ground. Have higher accuracy. Climb fast and successfully.,,4,"179,4","44,B1",0,1,1,0,0,0,3,x,2
44,B2,8575,TRUE,0,1,0,0,0,0,0,4,5,0,2,0,FALSE,FALSE,FALSE,TRUE,TRUE,2,x,3,Could technically hold algae and coral at the same time,,4,"8575,4","44,B2",0,1,0,0,1,1,2,x,3
44,B3,5660,TRUE,0,0,0,0,0,0,2,3,3,0,0,3,FALSE,TRUE,FALSE,FALSE,TRUE,x,x,2,"Auto was broken, simple and reliable intake, slow cycle time",,4,"5660,4","44,B3",0,1,1,0,0,1,x,x,2
44,R1,226,TRUE,1,0,0,1,0,0,3,3,4,2,0,2,FALSE,TRUE,FALSE,FALSE,TRUE,2,x,2,"It failed to make shots a lot of the time, but it was pretty good with alge. Overall sloppy.",,4,"226,4","44,R1",0,1,1,0,0,1,2,x,2
44,R2,4607,TRUE,3,0,0,0,0,0,4,3,1,0,0,1,FALSE,FALSE,FALSE,TRUE,TRUE,2,x,2,Relatively accurate with coral Not accurate with algae Fast cycle time Consistent intake Missed algae in the net Client failed They filled the reef,,4,"4607,4","44,R2",0,1,0,0,1,1,2,x,2
44,R3,10291,TRUE,0,1,0,0,0,0,0,3,3,1,2,0,FALSE,FALSE,FALSE,TRUE,TRUE,2,x,2,Had ok cycle times and was able to start clearing the reef in auto,,4,"10291,4","44,R3",0,1,0,0,1,1,2,x,2
45,B1,302,TRUE,2,0,0,0,0,0,4,2,2,1,1,1,FALSE,FALSE,FALSE,TRUE,FALSE,2,x,2,"Can work on both algae and coral, can hold algae well. Takes time on aiming but have higher accuracy. Dont know if it be able to climb.",,4,"302,4","45,B1",0,1,0,0,1,0,2,x,2
45,B2,1731,TRUE,2,0,0,0,0,0,3,5,3,1,0,0,FALSE,TRUE,FALSE,FALSE,TRUE,3,x,2,Algae removal was by mistake,,4,"1731,4","45,B2",0,1,1,0,0,1,3,x,2
45,B3,2648,TRUE,1,0,0,0,0,0,0,4,3,0,1,0,FALSE,TRUE,FALSE,FALSE,TRUE,2,x,2,"Can manipulate coral and alge, fast cycle time, intake can be inconsistent",,4,"2648,4","45,B3",0,1,1,0,0,1,2,x,2
45,R1,9484,TRUE,0,0,0,0,,,,,,0,0,,,FALSE,FALSE,TRUE,,,,,,,4,"9484,4","45,R1",0,1,0,0,1,0,,,
45,R2,4013,TRUE,1,0,0,0,0,0,0,0,0,0,0,0,TRUE,FALSE,FALSE,TRUE,FALSE,x,1,x,Scored one coral in L4 during auto Failed everything else Defense did not work at all It appeared that the robot got stuck in front of the coral Station,,4,"4013,4","45,R2",1,1,0,0,1,0,x,1,x
45,R3,1678,TRUE,4,0,0,0,0,0,5,5,4,1,2,1,FALSE,TRUE,FALSE,FALSE,TRUE,3,x,3,"Had great cycle times, could score on all levels, had a four coral auto, and a fast deep climb",,4,"1678,4","45,R3",0,1,1,0,0,1,3,x,3
46,B1,6995,TRUE,3,0,0,0,0,0,2,3,5,0,0,5,FALSE,FALSE,FALSE,TRUE,TRUE,3,x,3,Doing well in auto. Can work on both algae and coral. Can pick coral up from the ground. Aiming fast and have high accuracy. Climb fast ( but I am not sure if it succeeded).,,4,"6995,4","46,B1",0,1,0,0,1,1,3,x,3
46,B2,4655,TRUE,3,0,0,0,0,0,1,5,6,0,2,1,FALSE,TRUE,FALSE,FALSE,TRUE,3,x,3,Grips algae very well,,4,"4655,4","46,B2",0,1,1,0,0,1,3,x,3
46,B3,649,TRUE,1,0,0,0,0,0,2,4,0,0,0,0,FALSE,FALSE,FALSE,TRUE,FALSE,x,x,2,"Slow speed, very thin arm, ground intake.",,4,"649,4","46,B3",0,1,0,0,1,0,x,x,2
46,R1,9432,TRUE,3,0,0,0,0,0,4,6,2,1,0,0,FALSE,TRUE,FALSE,FALSE,FALSE,3,x,3,"Fast and accurate, only missing a few times.",,3,"9432,3","46,R1",0,1,1,0,0,0,3,x,3
46,R2,4068,TRUE,1,0,0,0,0,0,3,0,1,0,3,0,FALSE,FALSE,FALSE,TRUE,TRUE,2,x,2,Outtake is unreliable Consistent algae scoring Good L4 scoring,,4,"4068,4","46,R2",0,1,0,0,1,1,2,x,2
46,R3,5968,TRUE,0,0,0,0,0,0,1,4,2,1,0,0,FALSE,FALSE,FALSE,TRUE,FALSE,1,x,2,"Laughable auto, very slow with just ok accuracy, had a lot of trouble lining up",,4,"5968,4","46,R3",0,1,0,0,1,0,1,x,2
47,B1,4415,TRUE,1,0,0,0,0,0,4,3,5,0,0,2,FALSE,TRUE,FALSE,FALSE,FALSE,3,x,3,Can work on both algae and coral. Aiming fast and have high accuracy. Can pick up corals from the ground.Climb fast and successfully.,,4,"4415,4","47,B1",0,1,1,0,0,0,3,x,3
47,B2,4967,TRUE,1,0,0,0,0,0,2,1,1,0,2,0,FALSE,FALSE,FALSE,TRUE,TRUE,3,x,2,Requires precision to score,,4,"4967,4","47,B2",0,1,0,0,1,1,3,x,2
47,B3,4786,TRUE,2,0,0,0,0,0,2,4,5,0,0,1,FALSE,FALSE,FALSE,TRUE,FALSE,3,x,3,"Very fast, short cycle time, can manipulate both game pieces,",,4,"4786,4","47,B3",0,1,0,0,1,0,3,x,3
47,R1,1671,TRUE,1,0,0,0,0,0,0,4,0,2,0,1,FALSE,FALSE,FALSE,TRUE,TRUE,2,x,2,"Sloppy execution, it could score, but inconsistently.",,4,"1671,4","47,R1",0,1,0,0,1,1,2,x,2
47,R2,1481,FALSE,0,0,0,0,0,0,0,0,0,0,0,0,FALSE,TRUE,FALSE,FALSE,TRUE,x,1,x,Did great in auto During teleop only played defense Defense was not good,,4,"1481,4","47,R2",0,0,1,0,0,1,x,1,x
47,R3,2630,TRUE,4,0,0,0,0,0,6,3,0,0,1,5,FALSE,TRUE,FALSE,FALSE,TRUE,3,x,3,"Very to jack in the bot, had a long arm capable of scoring everywhere, and had a fast deep climb",,4,"2630,4","47,R3",0,1,1,0,0,1,3,x,3
48,B1,7197,TRUE,2,0,0,0,0,0,3,6,2,2,0,0,FALSE,FALSE,FALSE,FALSE,TRUE,2,x,2,"Can pick up coral from the ground, but can only work on L1. Have higher accuracy. Doing fine in auto.",,4,"7197,4","48,B1",0,1,0,0,0,1,2,x,2
48,B2,7257,TRUE,2,0,0,0,0,0,3,4,3,0,0,0,FALSE,TRUE,FALSE,FALSE,FALSE,3,x,2,Speed sometimes rocks robot,,4,"7257,4","48,B2",0,1,1,0,0,0,3,x,2
48,B3,6017,TRUE,0,0,0,0,0,0,1,2,0,0,0,0,FALSE,FALSE,FALSE,TRUE,TRUE,x,x,1,"Simple and effective intake, alignment issues,",,4,"6017,4","48,B3",0,1,0,0,1,1,x,x,1
48,R1,9199,TRUE,1,0,0,0,0,0,4,2,1,0,0,0,FALSE,FALSE,FALSE,TRUE,TRUE,2,x,3,"It was pretty average, nothing crazy impressive, but nothing really bad about it. Everything worked well, and they could score with a semi good cycle.",,4,"9199,4","48,R1",0,1,0,0,1,1,2,x,3
48,R2,4500,TRUE,2,0,0,0,0,0,2,6,1,0,0,0,FALSE,TRUE,FALSE,FALSE,TRUE,2,x,x,Poor coral placement Climb was touching the chain Slow intake Fast outtake,,4,"4500,4","48,R2",0,1,1,0,0,1,2,x,x
48,R3,1847,TRUE,0,0,0,0,0,0,2,2,5,1,0,0,FALSE,TRUE,FALSE,FALSE,FALSE,2,x,2,"Looked like it had trouble deciding where to score, missed in auto",,4,"1847,4","48,R3",0,1,1,0,0,0,2,x,2
49,B1,8738,TRUE,2,0,0,1,0,0,5,3,4,0,0,2,FALSE,FALSE,FALSE,TRUE,FALSE,2,x,2,failed 1 coral. wastes time positioning. went to the climb pretty early but still failed deepclimb.,,4,"8738,4","49,B1",0,1,0,0,1,0,2,x,2
49,B2,1507,TRUE,2,0,0,0,0,0,3,1,1,0,3,0,FALSE,TRUE,FALSE,FALSE,TRUE,2,x,2,Overall slow. Struggled to ground intake algae. Fast climb,,4,"1507,4","49,B2",0,1,1,0,0,1,2,x,2
49,B3,6909,TRUE,0,0,0,0,0,0,0,3,4,1,0,0,FALSE,FALSE,FALSE,TRUE,FALSE,2,x,2,"Missed coral in auto, not very fast cycle time, had a lot of trouble lining up for climb",,4,"6909,4","49,B3",0,1,0,0,1,0,2,x,2
49,R1,4005,TRUE,1,0,0,0,0,0,2,2,4,0,0,0,FALSE,FALSE,FALSE,TRUE,FALSE,x,x,2,Had trouble lining up on reef which led to a substantial detriment to their speed and efficiency,,4,"4005,4","49,R1",0,1,0,0,1,0,x,x,2
49,R2,78,TRUE,4,0,0,0,0,0,4,4,2,2,2,0,FALSE,TRUE,FALSE,FALSE,FALSE,3,x,3,"Very speedy, strange similarity to Jack in The Bot with their auto and climb. Very speedy and accurate, reliable for quick scoring",,4,"78,4","49,R2",0,1,1,0,0,0,3,x,3
49,R3,4613,TRUE,0,1,0,0,0,1,0,6,6,0,0,2,FALSE,TRUE,FALSE,FALSE,TRUE,3,x,3,"No L4, can score algae and coral anywhere but L4. Ground intake, slower cycles though.",,4,"4613,4","49,R3",0,1,1,0,0,1,3,x,3
50,B1,3173,TRUE,3,0,0,0,0,0,4,5,3,0,0,2,FALSE,TRUE,FALSE,FALSE,TRUE,x,x,x,sucessful auto. pretty good cycle. removed algae to make room and to score net. very fast deepclimb.,,4,"3173,4","50,B1",0,1,1,0,0,1,x,x,x
50,B2,6911,TRUE,1,0,0,0,0,1,0,0,0,0,0,1,FALSE,FALSE,FALSE,TRUE,TRUE,1,2,2,Coral got stuck in intake halfway through and forced them to defense.,,4,"6911,4","50,B2",0,1,0,0,1,1,1,2,2
50,B3,7525,TRUE,3,0,0,0,0,0,3,4,6,0,0,0,FALSE,FALSE,FALSE,TRUE,FALSE,2,x,3,"Fast cycle time, no trouble intaking coral, only went to barge at last minute, elevator looked rough when going up",,4,"7525,4","50,B3",0,1,0,0,1,0,2,x,3
50,R1,1425,TRUE,3,0,0,0,0,0,6,7,0,0,0,1,FALSE,FALSE,FALSE,TRUE,FALSE,x,x,3,"Very accurate, but takes a bit to cycle. Very good auto, but failed to climb in time",,4,"1425,4","50,R1",0,1,0,0,1,0,x,x,3
50,R2,3284,TRUE,0,0,0,0,0,1,0,0,0,0,0,0,FALSE,FALSE,FALSE,TRUE,FALSE,1,2,1,"So sorry, I was looking at blue for the first bit of the match before realizing I was scouting the wrong one. I am assuming based on the fact they switched to defense that they were having struggles with offense, which is why I gave them a low score.",,4,"3284,4","50,R2",0,1,0,0,1,0,1,2,1
50,R3,10260,TRUE,0,0,0,1,0,0,0,0,0,6,0,0,FALSE,FALSE,FALSE,TRUE,FALSE,1,x,2,KIT BOOOOOOT! Only L1. No algae. No climb. Coral station intake only.,,4,"10260,4","50,R3",0,1,0,0,1,0,1,x,2
51,B1,8808,TRUE,1,0,0,0,0,0,4,2,2,0,0,0,FALSE,FALSE,FALSE,TRUE,TRUE,3,x,2,1.5 coral auto. removed algae to score. went to the barge quite late.,,5,"8808,5","51,B1",0,1,0,0,1,1,3,x,2
51,B2,537,TRUE,0,0,0,0,0,0,2,4,3,0,0,0,FALSE,FALSE,FALSE,TRUE,FALSE,2,x,1,Missed coral in auto. Missed lot of the l2 coral. Fell off of the cage,,5,"537,5","51,B2",0,1,0,0,1,0,2,x,1
51,B3,694,TRUE,3,0,0,0,0,0,2,4,4,0,6,2,FALSE,TRUE,FALSE,FALSE,TRUE,3,x,3,"Couldve scored another in auto but missed a intake, doesnt have to turn around when taking coral, very fast cycle time, missed a couple processor shots",,5,"694,5","51,B3",0,1,1,0,0,1,3,x,3
51,R1,1796,TRUE,4,0,0,0,0,0,2,3,4,0,0,4,FALSE,FALSE,FALSE,TRUE,FALSE,x,x,3,"Has a four cycle auto, and can hold both game pieces and score them at the same time",,5,"1796,5","51,R1",0,1,0,0,1,0,x,x,3
51,R2,9280,TRUE,0,0,0,0,0,0,4,1,1,0,2,0,FALSE,TRUE,FALSE,FALSE,TRUE,3,x,3,"Only missed a couple times when scoring. Not the best, not the worst, could use some improvements in cycle time, reliable for L4 and processor scoring",,5,"9280,5","51,R2",0,1,1,0,0,1,3,x,3
51,R3,6146,TRUE,0,0,1,0,0,0,2,3,2,0,0,0,FALSE,TRUE,FALSE,FALSE,FALSE,1,x,2,SO DANG SLOW MOVEMENT AND OMG SLOW ELEVATOR!?!?! Pretty good aim. No ground intake or algae.,,5,"6146,5","51,R3",0,1,1,0,0,0,1,x,2
52,B1,4451,TRUE,2,0,0,0,0,0,4,5,2,0,0,2,FALSE,TRUE,FALSE,FALSE,TRUE,3,x,3,failed 3 coral. was pretty good at scoring everything exept L1 but it gave up very quickly. removed algae only to score.,,6,"4451,6","52,B1",0,1,1,0,0,1,3,x,3
52,B2,10291,TRUE,0,0,0,0,0,0,0,5,4,0,0,0,FALSE,TRUE,FALSE,FALSE,FALSE,2,x,2,Slow auto. Missed L2-L3,,5,"10291,5","52,B2",0,1,1,0,0,0,2,x,2
52,B3,4421,TRUE,3,0,0,0,0,0,4,3,5,0,0,1,FALSE,FALSE,FALSE,TRUE,TRUE,2,x,3,"Fast cycle time, almost ran into teammates once, auto had paused for split seconds, couldnt score on l1",,5,"4421,5","52,B3",0,1,0,0,1,1,2,x,3
52,R1,7048,TRUE,2,0,0,0,0,0,3,2,2,1,0,0,FALSE,FALSE,FALSE,TRUE,FALSE,x,x,2,"Somewhat fast, but has difficulty lining up to the reef. Cant climb, but has decent auto",,5,"7048,5","52,R1",0,1,0,0,1,0,x,x,2
52,R2,10698,TRUE,0,0,0,0,0,0,2,4,0,0,0,0,FALSE,TRUE,FALSE,FALSE,TRUE,2,x,2,"Not the best, not the worst. Incredibly slow cycle time, takes a chunk of time to aim, but rarely missed. Wasted a lot of time missing coral from the station. Pretty good at L4 scoring",,5,"10698,5","52,R2",0,1,1,0,0,1,2,x,2
52,R3,6083,TRUE,1,0,0,0,0,0,1,4,1,2,0,0,FALSE,FALSE,FALSE,TRUE,FALSE,1,x,1,Missed many L4s and 3s. No algae. No ground intake. Ok cycles. Slow elevator and movement speed.,,5,"6083,5","52,R3",0,1,0,0,1,0,1,x,1
53,B1,1678,TRUE,4,0,0,0,0,0,1,6,6,0,1,2,FALSE,TRUE,FALSE,FALSE,TRUE,3,x,3,sucessful auto 4 coral. robot stole algae from other side and scored in the other teams processor for the coopertition bonus. super fast cycle but struggled with L1,,5,"1678,5","53,B1",0,1,1,0,0,1,3,x,3
53,B2,6424,TRUE,1,0,0,0,1,0,3,4,2,0,1,1,FALSE,TRUE,FALSE,FALSE,TRUE,3,x,3,Fast outtake and scoring. Fast climb. Not good against defense,,5,"6424,5","53,B2",0,1,1,0,0,1,3,x,3
53,B3,1833,TRUE,3,0,0,0,0,0,0,2,4,9,0,0,FALSE,FALSE,FALSE,TRUE,FALSE,3,x,3,"Very fast cycle time, couldve scored another in auto but missed intake, worked well around defense to still intake",,5,"1833,5","53,B3",0,1,0,0,1,0,3,x,3
53,R1,9312,TRUE,0,0,1,0,0,0,0,0,3,5,0,0,FALSE,TRUE,FALSE,FALSE,FALSE,x,x,1,"The robot is fast, but very inaccurate, and to add on to that it can only really score in L1 and L2 meaning that they add little to the point score",,5,"9312,5","53,R1",0,1,1,0,0,0,x,x,1
53,R2,3256,TRUE,0,0,0,0,0,0,5,0,2,0,0,0,FALSE,FALSE,FALSE,TRUE,TRUE,3,x,3,"Similar to us skill level wise, decent cycle time, reliable for L4 scoring and algae removal, overall a well balanced robot that gets the job done",,5,"3256,5","53,R2",0,1,0,0,1,1,3,x,3
53,R3,2438,TRUE,0,0,0,0,0,0,0,0,0,0,0,0,FALSE,FALSE,FALSE,TRUE,FALSE,x,2,x,"Broken from start. Ok defense, but not amazing, can be pushed around a little.",,5,"2438,5","53,R3",0,1,0,0,1,0,x,2,x
54,B1,3297,TRUE,1,0,0,0,0,1,6,0,0,1,1,1,FALSE,FALSE,FALSE,TRUE,FALSE,x,x,2,sucessful 1 coral one algae auto. had a wobbly arm preventing it from being accurate. did not attempt climb.,,5,"3297,5","54,B1",0,1,0,0,1,0,x,x,2
54,B2,6348,TRUE,0,0,0,0,0,0,3,3,0,0,0,0,FALSE,FALSE,FALSE,TRUE,TRUE,2,x,2,Slow elevator. Hard to align intake. Good algae removal.,,5,"6348,5","54,B2",0,1,0,0,1,1,2,x,2
54,B3,3891,TRUE,0,0,0,2,0,0,2,7,3,0,0,0,FALSE,FALSE,FALSE,FALSE,FALSE,2,x,3,"Got defended well against, both l1 scores in auto are from missed l4, fast driving",,5,"3891,5","54,B3",0,1,0,0,0,0,2,x,3
54,R1,6832,TRUE,0,0,0,0,0,0,0,0,0,0,0,0,FALSE,FALSE,FALSE,TRUE,FALSE,x,3,x,Faulty auto cycle got coral stuck in main body leading to them having to play defense for all of teleop,,5,"6832,5","54,R1",0,1,0,0,1,0,x,3,x
54,R2,8575,TRUE,0,2,0,0,0,0,0,8,1,1,2,0,FALSE,FALSE,FALSE,TRUE,TRUE,3,x,3,"Speedy cycle times, great accuracy, very reliable for L3 scoring. Well balanced robot (I missed a little bit of autonomous because my page refreshed and the sheet reset)",,5,"8575,5","54,R2",0,1,0,0,1,1,3,x,3
54,R3,1731,TRUE,0,0,0,0,0,0,12,0,0,1,0,0,FALSE,FALSE,FALSE,TRUE,TRUE,3,x,3,Very consistent with good speed and cycles. No algae or ground intake. Can score coral all levels.,,5,"1731,5","54,R3",0,1,0,0,1,1,3,x,3
55,B1,649,TRUE,1,0,0,0,0,0,4,1,3,0,0,0,FALSE,FALSE,FALSE,TRUE,FALSE,1,x,3,"They were really slow, and the coral often got stick on them.",,5,"649,5","55,B1",0,1,0,0,1,0,1,x,3
55,B2,5660,TRUE,1,0,0,0,0,2,1,4,2,0,0,2,FALSE,FALSE,FALSE,TRUE,TRUE,2,x,1,Terrible coral accuracy Good algae accuracy Good algae cycle time Good deep climb,,5,"5660,5","55,B2",0,1,0,0,1,1,2,x,1
55,B3,3255,TRUE,3,0,0,0,0,0,1,4,4,0,2,0,FALSE,FALSE,FALSE,TRUE,TRUE,2,x,2,Missed a few shots on L2 but was reasonably fast and able to clear the reef,,5,"3255,5","55,B3",0,1,0,0,1,1,2,x,2
55,R1,900,TRUE,2,0,0,0,0,0,3,5,2,0,0,0,FALSE,FALSE,FALSE,TRUE,FALSE,3,x,3,They had very fast Cloes on all levels did stop/disabled mid match,,5,"900,5","55,R1",0,1,0,0,1,0,3,x,3
55,R2,4655,TRUE,1,0,0,0,0,2,1,0,3,0,2,6,FALSE,FALSE,FALSE,TRUE,TRUE,3,x,3,Focus on algea fast at all levels focused l2 to get ranking point,,5,"4655,5","55,R2",0,1,0,0,1,1,3,x,3
55,R3,7034,TRUE,3,0,0,0,0,0,2,5,5,0,0,0,FALSE,FALSE,FALSE,TRUE,FALSE,3,x,3,"Smooth and fast cycles, successful three coral auto, missed like once",,5,"7034,5","55,R3",0,1,0,0,1,0,3,x,3
56,B1,4013,TRUE,0,0,0,0,0,0,0,0,0,0,0,0,TRUE,FALSE,FALSE,FALSE,FALSE,x,x,x,"Their auto missed, then they disabled for the rest of the match.",,5,"4013,5","56,B1",1,1,0,0,0,0,x,x,x
56,B2,9432,TRUE,3,0,0,0,0,0,1,5,5,2,0,2,FALSE,TRUE,FALSE,FALSE,TRUE,3,x,2,Knocked  a bunch of coral off the lower side of the reef Scored really consistently and fast Outtake was very consistent Climb was fast Can score both algae and coral well.Very fast cycles. At the end knocked into reef and descored 4 coral. Put one coral in and went to climb.,,4,"9432,4","56,B2",0,1,1,0,0,1,3,x,2
56,B3,302,TRUE,3,0,0,0,0,0,2,2,1,0,2,0,FALSE,FALSE,FALSE,TRUE,TRUE,2,x,2,"Deep climb broke at the end, seemed very unstable and was extremely wobbly",,5,"302,5","56,B3",0,1,0,0,1,1,2,x,2
56,R1,7257,TRUE,2,0,0,0,0,0,4,5,2,1,0,0,FALSE,TRUE,FALSE,FALSE,FALSE,2,x,3,They were a average cycled they could do all levels in good time,,5,"7257,5","56,R1",0,1,1,0,0,0,2,x,3
56,R2,4786,TRUE,1,0,0,0,0,2,0,3,4,2,0,4,FALSE,TRUE,FALSE,FALSE,TRUE,x,x,x,comment lost,,5,"4786,5","56,R2",0,1,1,0,0,1,x,x,x
56,R3,2129,TRUE,3,0,0,0,0,0,2,4,5,5,2,0,FALSE,FALSE,FALSE,TRUE,TRUE,3,x,3,Solid three coral auto that combos into a free L4. Driver has enough sense to get the coral rank point,,5,"2129,5","56,R3",0,1,0,0,1,1,3,x,3
57,B1,4967,TRUE,1,0,0,0,0,2,2,3,3,0,0,0,FALSE,TRUE,FALSE,FALSE,TRUE,2,x,1,"Fast but misses a lot, good with alge though. Auto is really good.",,5,"4967,5","57,B1",0,1,1,0,0,1,2,x,1
57,B2,418,TRUE,3,0,0,0,0,0,3,5,5,0,0,0,FALSE,TRUE,FALSE,FALSE,TRUE,3,x,3,"Removed algae two times. Consistent and fast cycles.Slow cycle time, but Good accuracy 3 coral auto",,5,"418,5","57,B2",0,1,1,0,0,1,3,x,3
57,B3,9032,TRUE,1,0,0,0,0,0,0,0,0,0,0,0,TRUE,FALSE,FALSE,FALSE,FALSE,x,x,x,"They climbed on the reef due to an auto issue, bro got hung",,4,"9032,4","57,B3",1,1,0,0,0,0,x,x,x
57,R1,8738,TRUE,3,0,0,0,0,0,1,4,0,0,0,1,FALSE,FALSE,FALSE,TRUE,TRUE,1,x,2,They could do algae but their mechanism for it was bad and cycled slowly,,5,"8738,5","57,R1",0,1,0,0,1,1,1,x,2
57,R2,3792,TRUE,0,0,0,0,0,0,0,0,0,6,7,0,FALSE,TRUE,FALSE,FALSE,TRUE,x,x,x,comment lost. Scored 2 in opposing processor. Very good at l1.,,,,,0,1,1,0,0,1,x,x,x
57,R3,226,TRUE,2,0,0,0,0,0,2,3,7,0,0,2,FALSE,TRUE,FALSE,FALSE,TRUE,3,x,2,"Auto attempted multiple coral but fails. Otherwise, good cycle times. Also likes to take algae off the reef and throw them into the net. And is good at it",,5,"226,5","57,R3",0,1,1,0,0,1,3,x,2
58,B1,1481,TRUE,1,0,0,0,0,0,5,4,0,0,0,0,FALSE,FALSE,FALSE,TRUE,TRUE,3,x,3,"Its was slower in pace, but overall well rounded, scoring all over the reef. Their was a point where the coral was stuck for awhile.",,5,"1481,5","58,B1",0,1,0,0,1,1,3,x,3
58,B2,5968,TRUE,1,0,0,0,0,0,2,0,0,0,0,0,TRUE,FALSE,FALSE,FALSE,FALSE,1,x,1,"Attempted four corals only made two  Robot shut down like 30 seconds in, got enabled with 5 seconds remaining.",,5,"5968,5","58,B2",1,1,0,0,0,0,1,x,1
58,B3,1369,TRUE,1,0,0,0,0,1,0,0,0,0,3,3,FALSE,FALSE,FALSE,TRUE,TRUE,2,x,3,"Had a very reliable algae outtake and a great intake, though separate intakes were used for the net and the processor",,5,"1369,5","58,B3",0,1,0,0,1,1,2,x,3
58,R1,1507,TRUE,1,0,0,1,0,0,3,1,3,0,2,0,FALSE,TRUE,FALSE,FALSE,TRUE,2,x,2,They would do algae removal but it only worker some times took along time not really good. Slow coral,,5,"1507,5","58,R1",0,1,1,0,0,1,2,x,2
58,R2,7525,TRUE,3,0,0,0,0,0,1,2,6,0,0,0,FALSE,FALSE,FALSE,FALSE,FALSE,x,x,x,,,,,,0,1,0,0,0,0,x,x,x
58,R3,9199,TRUE,1,0,0,0,0,0,3,2,1,0,0,0,FALSE,FALSE,FALSE,TRUE,FALSE,x,x,x,I was watching the wrong robot. They all looked the same. Sorry,,5,"9199,5","58,R3",0,1,0,0,1,0,x,x,x
59,B1,4415,TRUE,2,0,0,0,0,0,3,0,3,0,2,2,FALSE,TRUE,FALSE,FALSE,TRUE,3,x,3,"They werent crazy fast, but they could remove and score alge everywhere, they were pretty good with coral too.",,5,"4415,5","59,B1",0,1,1,0,0,1,3,x,3
59,B2,4613,TRUE,0,1,0,0,0,1,0,5,4,1,0,3,FALSE,TRUE,FALSE,FALSE,TRUE,2,x,1,Auto took off an algae at the end too. Missed coral outtake 2 times. Scored lots of algae Very inaccurate coral scoring on all levels,,5,"4613,5","59,B2",0,1,1,0,0,1,2,x,1
59,B3,4500,TRUE,3,0,0,0,0,0,3,3,2,0,0,0,FALSE,TRUE,FALSE,FALSE,FALSE,2,x,2,Had issues due to some potent defense,,5,"4500,5","59,B3",0,1,1,0,0,0,2,x,2
59,R1,9301,FALSE,0,0,0,0,0,0,0,0,0,8,2,0,FALSE,TRUE,FALSE,FALSE,FALSE,1,x,2,They can get algae and score L1 but both slow and have trouble grabbing the game peices,,5,"9301,5","59,R1",0,0,1,0,0,0,1,x,2
59,R2,4607,TRUE,3,0,0,0,0,0,5,8,0,0,0,2,FALSE,TRUE,FALSE,FALSE,TRUE,x,x,x,comment lost,,5,"4607,5","59,R2",0,1,1,0,0,1,x,x,x
59,R3,6911,TRUE,1,0,0,0,0,0,0,0,0,0,0,0,FALSE,FALSE,FALSE,TRUE,TRUE,x,2,x,Experienced technically difficulties I believe and did defense the whole round,,5,"6911,5","59,R3",0,1,0,0,1,1,x,2,x
60,B1,6909,TRUE,0,0,0,0,0,0,0,4,3,0,0,0,FALSE,TRUE,FALSE,FALSE,FALSE,2,x,3,"Can score at a decent speed and rarely missed, it is slower though.",,5,"6909,5","60,B1",0,1,1,0,0,0,2,x,3
60,B2,9485,TRUE,0,0,0,0,0,0,0,3,2,0,0,0,FALSE,TRUE,FALSE,FALSE,TRUE,1,2,1,"Poor coral placement choice, Got a coral stuck inside halfway and decided to go do defense, in between not effective and average defense performance",,1,"9485,1","60,B2",0,1,1,0,0,1,1,2,1
60,B3,2724,TRUE,0,1,0,0,0,0,0,1,2,0,2,5,FALSE,FALSE,FALSE,TRUE,TRUE,3,x,3,Had a reliable way to score algae and clear the reef very quickly,,5,"2724,5","60,B3",0,1,0,0,1,1,3,x,3
60,R1,6995,TRUE,3,0,0,0,0,0,0,0,0,0,0,0,TRUE,FALSE,FALSE,FALSE,FALSE,1,x,1,Disabled,,5,"6995,5","60,R1",1,1,0,0,0,0,1,x,1
60,R2,6017,TRUE,0,0,0,1,0,0,0,0,0,4,0,0,FALSE,TRUE,FALSE,FALSE,FALSE,x,x,x,comment lost,,,,,0,1,1,0,0,0,x,x,x
60,R3,1671,TRUE,1,0,0,0,0,0,7,0,1,0,2,2,FALSE,TRUE,FALSE,FALSE,TRUE,3,x,3,Can grab algae off the reef and score it in the processor,,5,"1671,5","60,R3",0,1,1,0,0,1,3,x,3
61,B1,4068,TRUE,3,0,0,0,0,0,4,7,4,0,1,1,FALSE,FALSE,FALSE,TRUE,FALSE,x,x,3,"Somewhat slow cycle speed, but has pretty good accuracy. Slow auto",,5,"4068,5","61,B1",0,1,0,0,1,0,x,x,3
61,B2,2648,TRUE,2,0,0,0,0,0,4,4,5,0,1,0,FALSE,TRUE,FALSE,FALSE,FALSE,2,x,3,"Quick and speedy cycle times, reliable for L4-L2 scoring. Similar to our robots capabilities. Intakes pretty well from the station, 2.5 L4 auto; has auto align, but its not very accurate, so the driver had to do some very jerky movements to compensate; strong processor bot, though it only attempted processor once for coopertition",,5,"2648,5","61,B2",0,1,1,0,0,0,2,x,3
61,B3,3284,TRUE,0,0,0,0,0,0,0,0,0,3,0,5,FALSE,FALSE,FALSE,TRUE,TRUE,2,x,2,"Only L1. Algae can score anywhere. Only ground intake for coral. Algae from reef and ground. Ok cycles and speed. Mostly used for algae, then extra coral if needed.",,5,"3284,5","61,B3",0,1,0,0,1,1,2,x,2
61,R1,78,TRUE,3,0,0,0,0,0,1,4,5,0,0,3,FALSE,TRUE,FALSE,FALSE,TRUE,3,x,2,Doing well in auto. Can work on both algae and coral. Aiming fast and higher accuracy. Climb successfully.,,5,"78,5","61,R1",0,1,1,0,0,1,3,x,2
61,R2,7197,TRUE,1,0,0,0,0,0,0,2,2,4,0,0,FALSE,FALSE,FALSE,TRUE,FALSE,2,x,2,Can score horizontally and vertically,,5,"7197,5","61,R2",0,1,0,0,1,0,2,x,2
61,R3,2056,TRUE,4,0,0,0,0,0,3,6,5,1,2,6,FALSE,TRUE,FALSE,FALSE,TRUE,x,x,3,"Ground intake, 4.5 auto, very fast cycle time for coral and alge, can hold coral and alge at the same time.",,5,"2056,5","61,R3",0,1,1,0,0,1,x,x,3
62,B1,10260,TRUE,0,0,0,1,0,0,0,0,0,6,0,0,FALSE,FALSE,FALSE,TRUE,FALSE,x,x,2,Can only score in L1 because it is just a drive base with a slide bolted to it,,5,"10260,5","62,B1",0,1,0,0,1,0,x,x,2
62,B2,179,TRUE,2,1,0,0,0,0,3,4,3,0,0,0,FALSE,TRUE,FALSE,FALSE,FALSE,3,x,3,"Phenomenally efficient robot. Reliable for all around scoring, besides algae, with quick cycle times and speedy accuracy. Sometimes struggled with intaking coral, but is incredibly resourceful. If something doesn't work out, they don't waste a ton of time on it",,5,"179,5","62,B2",0,1,1,0,0,0,3,x,3
62,B3,494,TRUE,2,0,0,0,0,0,3,2,5,0,0,1,FALSE,TRUE,FALSE,FALSE,TRUE,3,x,3,"Very consistent, slow elevator and movement, ok cycles, can score anything anywhere.",,5,"494,5","62,B3",0,1,1,0,0,1,3,x,3
62,R1,3492,TRUE,0,0,0,0,0,0,0,4,3,0,0,0,FALSE,FALSE,FALSE,FALSE,FALSE,1,x,2,"Mostly work on the coral under L4. Should be able to do, but they didnt.",,5,"3492,5","62,R1",0,1,0,0,0,0,1,x,2
62,R2,1847,TRUE,0,0,0,0,0,0,3,0,0,0,0,0,FALSE,TRUE,FALSE,FALSE,FALSE,1,x,1,Must be very well aligned to score,,5,"1847,5","62,R2",0,1,1,0,0,0,1,x,1
62,R3,4005,TRUE,0,0,0,0,0,0,3,0,0,0,0,0,FALSE,FALSE,FALSE,TRUE,TRUE,x,x,1,"Something was broken, speed was l, maybe a flat battery",,5,"4005,5","62,R3",0,1,0,0,1,1,x,x,1
