Match #,Robot,Team #,Mobility,aL4,aL3,aL2,aL1,aProcessor,aNet,tL4,tL3,tL2,tL1,tProcessor,tNet,Disabled,Deep,Shallow,Park,Algae Removal,Offense,Defense,Accuracy,Comments,Mistake box,Index,"Team, index",Match index,Disable,Mobility,Deep,Shallow,Park,Removal,Offense,Defense,Accuracy
1,B1,9484,TRUE,0,0,0,0,0,0,0,3,0,0,0,0,FALSE,FALSE,FALSE,TRUE,FALSE,x,x,2,"Very poor auto, kind of slow and unstable, consistently knock its own coral off the reef",,1,"9484,1","1,B1",0,1,0,0,1,0,x,x,2
1,B2,3256,TRUE,1,0,0,0,0,0,2,2,2,1,0,4,FALSE,FALSE,FALSE,TRUE,TRUE,2,x,3,"Good cycle time, reliable for net scoring and lower level reef scoring. Cannot effectively ground intake algae, but is able to quickly switch back to coral scoring. Struggles with climbing",,1,"3256,1","1,B2",0,1,0,0,1,1,2,x,3
1,B3,4451,TRUE,2,0,0,0,0,0,4,0,0,6,0,0,FALSE,TRUE,FALSE,FALSE,FALSE,2,x,2,Ok cycles but missed a lot of L 1 and was a little wobbly on L 4. No ground intake or algae.,,1,"4451,1","1,B3",0,1,1,0,0,0,2,x,2
1,R1,4655,TRUE,3,0,0,0,0,0,3,3,4,0,0,0,FALSE,TRUE,FALSE,FALSE,FALSE,3,x,2,"Working well in auto, working on coral, from L2-4, have higher accuracy and climb fast.",,1,"4655,1","1,R1",0,1,1,0,0,0,3,x,2
1,R2,2056,TRUE,5,0,0,0,0,0,1,4,5,4,2,0,FALSE,TRUE,FALSE,FALSE,TRUE,3,x,3,Auto scores 5 coral,,1,"2056,1","1,R2",0,1,1,0,0,1,3,x,3
1,R3,4415,TRUE,0,0,0,0,0,1,1,2,4,0,0,1,FALSE,TRUE,FALSE,FALSE,TRUE,x,x,x,"Didnt score on L4, descent cycle time, coral could get stuck in the robot",,1,"4415,1","1,R3",0,1,1,0,0,1,x,x,x
2,B1,4068,TRUE,1,0,0,0,0,2,1,4,4,1,0,1,FALSE,FALSE,FALSE,TRUE,FALSE,x,x,3,"Can handle both coral and algae even during auto, very fast, but cant climb",,1,"4068,1","2,B1",0,1,0,0,1,0,x,x,3
2,B2,4607,TRUE,3,0,0,0,0,0,1,2,5,0,0,3,FALSE,TRUE,FALSE,FALSE,FALSE,3,x,3,"Very reliable for lower level scoring, resourceful- switched to net scoring for algae when reef was filled. Quick cycle times, good at grabbing from station",,1,"4607,1","2,B2",0,1,1,0,0,0,3,x,3
2,B3,1796,TRUE,3,0,0,0,0,0,3,5,3,3,2,1,FALSE,TRUE,FALSE,FALSE,TRUE,3,x,3,"Very fast cycles, can score anything anywhere, no ground intake but has very good funnel that allows for as fast of cycles.",,1,"1796,1","2,B3",0,1,1,0,0,1,3,x,3
2,R1,6083,TRUE,1,0,0,0,0,0,1,0,2,0,2,0,FALSE,FALSE,FALSE,TRUE,TRUE,2,x,3,"1 L4 coral and algae removal in auto, move slowly and takes time on aiming. Can work on algae and coral, not sure if it be able to climb.",,1,"6083,1","2,R1",0,1,0,0,1,1,2,x,3
2,R2,1671,TRUE,3,0,0,0,0,0,2,4,3,0,0,1,FALSE,TRUE,FALSE,FALSE,TRUE,2,x,3,Climb attached to intake,,1,"1671,1","2,R2",0,1,1,0,0,1,2,x,3
2,R3,7257,TRUE,2,0,0,0,0,0,1,7,5,0,0,0,FALSE,TRUE,FALSE,FALSE,FALSE,x,x,3,"Slower cycle time, extremely consistent with scoring, reliable climb",,1,"7257,1","2,R3",0,1,1,0,0,0,x,x,3
3,B1,2724,TRUE,0,0,0,0,0,1,0,4,1,0,0,0,FALSE,TRUE,FALSE,FALSE,FALSE,x,x,2,"Could handle both game pieces, but often had algae fall out of end effector.",,1,"2724,1","3,B1",0,1,1,0,0,0,x,x,2
3,B2,1425,TRUE,3,0,0,0,0,0,4,4,0,1,0,1,FALSE,TRUE,FALSE,FALSE,TRUE,3,x,3,"Reliable for L4 scoring, intaking from coral station is smooth, algae mechanism struggles to remove algae but is good at net scoring, scored quicker on section of the reef facing driver station",,1,"1425,1","3,B2",0,1,1,0,0,1,3,x,3
3,B3,3792,TRUE,0,0,0,0,0,0,0,0,0,8,4,0,FALSE,FALSE,FALSE,TRUE,TRUE,2,x,2,Only L1 scoring with good algae processor. No elevator.,,1,"3792,1","3,B3",0,1,0,0,1,1,2,x,2
3,R1,4421,TRUE,0,0,0,0,0,0,1,0,0,0,0,2,FALSE,TRUE,FALSE,FALSE,TRUE,x,x,1,"Have higher accuracy on algae, but not for corals. Climb successfully.",,1,"4421,1","3,R1",0,1,1,0,0,1,x,x,1
3,R2,6832,FALSE,0,0,0,0,0,0,0,0,0,3,2,0,FALSE,FALSE,FALSE,TRUE,TRUE,1,x,2,Appears to only be able to score in L1,,1,"6832,1","3,R2",0,0,0,0,1,1,1,x,2
3,R3,1507,TRUE,1,0,0,0,0,0,0,0,0,1,3,0,FALSE,TRUE,FALSE,FALSE,TRUE,x,x,x,Coral got stuck in elevator during autonomous period due do improper load by the human player crippling the robot,,1,"1507,1","3,R3",0,1,1,0,0,1,x,x,x
4,B1,6017,FALSE,0,0,0,0,0,0,3,0,1,0,0,0,FALSE,TRUE,FALSE,FALSE,FALSE,x,x,1,"Very fast, snappy end effector that often flung coral out of itself when cycling. No auto",,1,"6017,1","4,B1",0,0,1,0,0,0,x,x,1
4,B2,9199,,0,0,0,0,0,0,4,0,1,1,0,0,FALSE,FALSE,FALSE,TRUE,FALSE,x,x,x,,,,,,,,,,,,,,
4,B3,6911,TRUE,1,0,0,0,0,1,5,1,1,0,2,6,FALSE,FALSE,FALSE,FALSE,TRUE,3,x,3,Slow movement but very smooth making fast cycles. Scores anything anywhere. Strong net algae scoring. Very consistent.,,1,"6911,1","4,B3",0,1,0,0,0,1,3,x,3
4,R1,6424,TRUE,2,0,0,0,0,0,2,4,8,1,0,0,FALSE,TRUE,FALSE,FALSE,FALSE,3,x,3,"Working well in auto (2 coral), get the corals smooth and have high accuracy on every level of coral. Climb successfully.",,1,"6424,1","4,R1",0,1,1,0,0,0,3,x,3
4,R2,6995,TRUE,1,0,0,0,0,2,3,4,0,0,2,2,FALSE,FALSE,FALSE,TRUE,TRUE,3,x,3,Can scoop coral off the ground,,1,"6995,1","4,R2",0,1,0,0,1,1,3,x,3
4,R3,418,TRUE,2,0,0,0,0,0,1,3,,2,0,0,FALSE,TRUE,FALSE,FALSE,FALSE,x,x,2,"Very complicated arm/elevator combo, two coral auto and fast climb",,1,"418,1","4,R3",0,1,1,0,0,0,x,x,2
5,B1,78,TRUE,0,0,0,0,0,0,1,4,3,4,0,2,FALSE,TRUE,FALSE,FALSE,FALSE,x,x,3,"Horrible accuracy during auto, but basically perfect during teleop. Can handle both game pieces very well",,1,"78,1","5,B1",0,1,1,0,0,0,x,x,3
5,B2,1833,TRUE,2,0,0,0,0,0,6,4,3,1,0,0,FALSE,TRUE,FALSE,FALSE,TRUE,3,x,3,"Sometimes struggled to intake from station, but very reliable for quick scoring on higher levels. Has an L1 scoring mechanism, didn't see much of it. Was able to score atleast 1 piece.",,1,"1833,1","5,B2",0,1,1,0,0,1,3,x,3
5,B3,8575,TRUE,0,1,0,0,0,0,0,3,2,0,0,0,FALSE,FALSE,FALSE,TRUE,TRUE,1,x,1,Very very slow movement and VERY slow elevator. One coral on L3 auto with one algae removal. I dont think they can score L4.,,1,"8575,1","5,B3",0,1,0,0,1,1,1,x,1
5,R1,4967,TRUE,0,0,0,0,0,0,1,0,0,0,0,0,FALSE,FALSE,FALSE,TRUE,TRUE,x,x,x,"Can work on coral on L4. Mostly work on algae removal, trying to hold it but failed. Trying to climb but failed.",,1,"4967,1","5,R1",0,1,0,0,1,1,x,x,x
5,R2,3492,TRUE,0,0,1,0,0,0,0,7,4,0,0,0,FALSE,FALSE,FALSE,TRUE,FALSE,2,x,2,Outtake sometimes knocked other coral off,,1,"3492,1","5,R2",0,1,0,0,1,0,2,x,2
5,R3,6146,TRUE,0,0,0,1,0,0,2,0,0,0,0,0,FALSE,FALSE,FALSE,TRUE,FALSE,x,1,x,"Very slow cycle time, major system must have failed before they played defense",,1,"6146,1","5,R3",0,1,0,0,1,0,x,1,x
6,B1,10291,TRUE,0,0,0,0,0,0,0,1,0,1,2,0,FALSE,TRUE,FALSE,FALSE,FALSE,x,x,2,"Very average speed, and accuracy. The way it holds algae is VERY janky",,1,"10291,1","6,B1",0,1,1,0,0,0,x,x,2
6,B2,649,TRUE,0,0,0,0,0,0,7,3,0,0,0,0,FALSE,FALSE,FALSE,TRUE,TRUE,2,x,3,"Autos were struggling. Not very fast cycle times, wastes a lot of time trying to intake. Good aiming system. Overall, wouldn't be a top pick, but wouldn't be a bottom either",,1,"649,1","6,B2",0,1,0,0,1,1,2,x,3
6,B3,10260,TRUE,0,0,0,0,0,0,0,0,0,9,0,0,FALSE,FALSE,FALSE,FALSE,FALSE,1,x,2,"KIT BOT!!! With nothing else. Only can score L1, no algae, no climb, very jerky stop and go driving.",,1,"10260,1","6,B3",0,1,0,0,0,0,1,x,2
6,R1,302,TRUE,1,0,0,0,0,0,4,4,4,0,0,2,FALSE,FALSE,FALSE,TRUE,TRUE,3,x,2,"Can work on both coral and algae, have higher accuracy and move smoothly and fast. Try to climb but failed.",,1,"302,1","6,R1",0,1,0,0,1,1,3,x,2
6,R2,6909,TRUE,0,0,0,0,0,0,0,0,2,4,0,0,FALSE,TRUE,FALSE,FALSE,FALSE,2,x,1,Climb takes 20 seconds,,1,"6909,1","6,R2",0,1,1,0,0,0,2,x,1
6,R3,4786,TRUE,0,0,0,0,0,0,1,1,0,2,2,0,FALSE,FALSE,FALSE,TRUE,FALSE,x,x,2,"Slow cycle time, didnt core L 4 very often",,1,"4786,1","6,R3",0,1,0,0,1,0,x,x,2
7,B1,9280,TRUE,0,0,0,0,0,0,5,0,0,0,0,0,FALSE,FALSE,FALSE,TRUE,TRUE,1,x,3,They were very very slow but made all the shots they took,,1,"9280,1","7,B1",0,1,0,0,1,1,1,x,3
7,B2,9312,TRUE,0,0,0,0,0,0,0,0,2,0,0,0,FALSE,TRUE,FALSE,FALSE,FALSE,1,x,1,"Auto was supposed to be at least one L1 but failed and then it went towards the coral station but didnt make it. Struggled with intake a lot, when it did intake it it fell out from hitting something. Outtake not good either.",,1,"9312,1","7,B2",0,1,1,0,0,0,1,x,1
7,B3,4005,TRUE,0,0,0,0,0,0,7,0,0,0,0,0,FALSE,FALSE,FALSE,TRUE,FALSE,3,x,2,"Deep climb is similar to ours, however it seemed to fail",,1,"4005,1","7,B3",0,1,0,0,1,0,3,x,2
7,R1,3297,TRUE,1,0,0,0,0,1,0,0,0,0,1,0,FALSE,FALSE,FALSE,TRUE,TRUE,x,3,3,sucessful auto. brought algae into the blue place to more effectively play defense. removed an algae to score and block blue. got stuck on one of their own algae but quickly unstuck itself.,,1,"3297,1","7,R1",0,1,0,0,1,1,x,3,3
7,R2,7197,TRUE,0,0,0,0,0,0,2,2,4,2,0,0,FALSE,FALSE,FALSE,TRUE,FALSE,2,x,1,Missed two coral in auto. Slow. Sometimes coral slips out of intake funnel,,1,"7197,1","7,R2",0,1,0,0,1,0,2,x,1
7,R3,5660,TRUE,3,0,0,0,0,0,2,5,4,1,0,2,FALSE,TRUE,FALSE,FALSE,TRUE,2,x,2,"Almost missed 2 corals in auto, shot out a coral early and missed in teleop, average driving",,1,"5660,1","7,R3",0,1,1,0,0,1,2,x,2
8,B1,4013,TRUE,0,0,0,0,0,0,0,0,0,0,2,0,FALSE,FALSE,FALSE,TRUE,FALSE,2,x,2,They were slow but seemed capable going to l1 l2 l3,,1,"4013,1","8,B1",0,1,0,0,1,0,2,x,2
8,B2,4613,TRUE,0,1,0,0,0,1,0,5,5,0,0,1,FALSE,TRUE,FALSE,FALSE,TRUE,3,x,3,Auto also removed two algae and tried to put it in the net but overshot. Missed coral two times. Missed algae in net one time.,,1,"4613,1","8,B2",0,1,1,0,0,1,3,x,3
8,B3,7034,TRUE,2,0,0,0,0,0,7,3,0,0,0,0,FALSE,TRUE,FALSE,FALSE,FALSE,3,x,3,Autonomous misses first coral in L4,,1,"7034,1","8,B3",0,1,1,0,0,0,3,x,3
8,R1,7048,TRUE,1,0,0,0,0,0,3,0,0,0,0,0,FALSE,FALSE,FALSE,TRUE,FALSE,1,x,1,failed 2.5. struggled to intake. spent lots of time positioning and lots of coral fell out. got stuck on algae and needed help getting out. no attempt to climb,,1,"7048,1","8,R1",0,1,0,0,1,0,1,x,1
8,R2,6348,TRUE,0,0,0,0,0,0,2,0,0,1,0,0,FALSE,FALSE,FALSE,TRUE,FALSE,1,x,1,Slow. Not accurate. Unstable at max extension. Dropped a few coral,,1,"6348,1","8,R2",0,1,0,0,1,0,1,x,1
8,R3,3173,TRUE,1,0,0,0,0,0,4,4,0,1,0,1,FALSE,FALSE,FALSE,TRUE,TRUE,2,x,1,"Missed 2 corals in auto and missed 2 L4 shots in teleop, didnt drive very fast",,1,"3173,1","8,R3",0,1,0,0,1,1,2,x,1
9,B1,1847,TRUE,1,0,0,0,0,0,3,3,3,1,0,0,FALSE,FALSE,FALSE,TRUE,FALSE,x,x,2,"They tired to climb did not, they were solid all level motion",,1,"1847,1","9,B1",0,1,0,0,1,0,x,x,2
9,B2,694,TRUE,3,0,0,0,0,0,3,4,4,1,2,1,FALSE,TRUE,FALSE,FALSE,FALSE,3,x,3,Very fast and consitent cycle. Auto was 3.5 piece. The L1 score was supposed to be L4.,,1,"694,1","9,B2",0,1,1,0,0,0,3,x,3
9,B3,1481,TRUE,1,0,0,0,0,0,1,3,2,0,0,0,FALSE,TRUE,FALSE,FALSE,TRUE,2,x,2,Auto attempts to score algae in barge but fails,,1,"1481,1","9,B3",0,1,1,0,0,1,2,x,2
9,R1,9032,TRUE,1,0,0,0,0,1,1,2,1,0,0,4,FALSE,FALSE,FALSE,TRUE,TRUE,3,x,3,successful auto. got an algae stuck in it and couldn't score for a while but got it out. robot seemed a bit lost for a while. removed algae only to score,,1,"9032,1","9,R1",0,1,0,0,1,1,3,x,3
9,R2,1678,TRUE,3,0,0,0,0,0,4,7,7,1,0,3,FALSE,TRUE,FALSE,FALSE,TRUE,3,x,3,"Fast, accurate. Fast climb. Missed one algae in net",,1,"1678,1","9,R2",0,1,1,0,0,1,3,x,3
9,R3,900,TRUE,1,0,0,0,0,0,2,3,3,0,0,0,FALSE,FALSE,FALSE,FALSE,FALSE,2,x,1,"Missed a l4 in auto and didnt have time to score a 3rd, missed over half their coral shots",,1,"900,1","9,R3",0,1,0,0,0,0,2,x,1
10,B1,179,TRUE,0,0,0,0,0,0,3,4,4,4,0,1,TRUE,FALSE,FALSE,FALSE,TRUE,x,x,x,They were doing great all levels great algae but then disabled,,1,"179,1","10,B1",1,1,0,0,0,1,x,x,x
10,B2,1731,TRUE,1,0,0,0,0,0,0,2,1,3,0,1,FALSE,TRUE,FALSE,FALSE,TRUE,2,x,2,Auto was also supposed to score an L4 but missed. Missed L4 3 times. Missed L1 3 times.,,1,"1731,1","10,B2",0,1,1,0,0,1,2,x,2
10,B3,8738,TRUE,0,0,0,0,0,0,4,1,3,1,0,0,FALSE,FALSE,FALSE,TRUE,FALSE,x,x,x,Really good intake.,,1,"8738,1","10,B3",0,1,0,0,1,0,x,x,x
10,R1,9301,TRUE,0,0,0,1,0,0,0,0,0,3,3,0,FALSE,FALSE,FALSE,FALSE,FALSE,2,x,3,got disabled a little before end. successful auto. kind of slow.,,1,"9301,1","10,R1",0,1,0,0,0,0,2,x,3
10,R2,10698,TRUE,0,0,0,0,0,0,0,1,0,0,0,0,FALSE,FALSE,FALSE,TRUE,TRUE,1,x,1,Slow. Struggled to intake. Coral fell out a few times.,,1,"10698,1","10,R2",0,1,0,0,1,1,1,x,1
10,R3,8808,TRUE,2,0,0,0,0,0,7,0,0,0,0,0,FALSE,FALSE,FALSE,FALSE,TRUE,2,x,1,"Missed multiple l4 shots and drove very slow without purpose, almost got stuck on reef trying to score l4",,1,"8808,1","10,R3",0,1,0,0,0,1,2,x,1
11,B1,3255,TRUE,0,0,0,1,0,0,2,3,0,0,0,3,FALSE,TRUE,FALSE,FALSE,TRUE,x,x,2,They had good on all levels just need to slow down for accurac,,1,"3255,1","11,B1",0,1,1,0,0,1,x,x,2
11,B2,7525,TRUE,1,0,0,0,0,0,0,0,0,0,0,0,FALSE,FALSE,FALSE,TRUE,FALSE,x,3,x,Looked like it was struggling to start moving the first few seconds but then when it started to move it played very good defense. Greatly effected opposite alliance robot,,1,"7525,1","11,B2",0,1,0,0,1,0,x,3,x
11,B3,9432,TRUE,3,0,0,0,0,0,6,2,0,0,0,3,FALSE,TRUE,FALSE,FALSE,TRUE,3,x,2,"Seems like a good bit in general. Quick cycle time and can remove algae, then put the algae in the net",,1,"9432,1","11,B3",0,1,1,0,0,1,3,x,2
11,R1,2648,TRUE,1,0,0,0,0,0,2,6,1,0,0,1,FALSE,TRUE,FALSE,FALSE,TRUE,3,x,3,sucessful auto. got defended but played well. went to barge immediatly when endgame started. removed algae only to score.,,1,"2648,1","11,R1",0,1,1,0,0,1,3,x,3
11,R2,2630,TRUE,3,0,0,0,0,0,5,2,0,0,0,5,FALSE,TRUE,FALSE,FALSE,TRUE,3,x,3,Very fast. Missed one coral in 4.5 coral auto. Fast intake. Fast algae throw into net,,1,"2630,1","11,R2",0,1,1,0,0,1,3,x,3
11,R3,3891,TRUE,0,0,0,0,0,0,0,0,0,0,0,0,FALSE,FALSE,FALSE,TRUE,FALSE,x,1,x,"Auto drove into walk then stopped, defense was just sitting there for most of match",,1,"3891,1","11,R3",0,1,0,0,1,0,x,1,x
12,B1,5968,TRUE,0,0,0,0,0,0,2,0,0,0,2,0,FALSE,FALSE,FALSE,TRUE,FALSE,x,x,2,They tried a lot and missy ed they can go to all levels but are slow,,1,"5968,1","12,B1",0,1,0,0,1,0,x,x,2
12,B2,537,TRUE,0,0,0,0,0,0,3,3,4,0,0,0,FALSE,TRUE,FALSE,FALSE,FALSE,2,x,3,It looked like auto was supposed to get more because it was just moving the elevator without moving at the start.,,1,"537,1","12,B2",0,1,1,0,0,0,2,x,3
12,B3,226,TRUE,3,0,0,0,0,0,0,3,4,0,0,1,FALSE,TRUE,FALSE,FALSE,TRUE,2,x,1,Only went for lower levels. May be for the ranking point or the elevator could be broken,,1,"226,1","12,B3",0,1,1,0,0,1,2,x,1
12,R1,3284,TRUE,0,0,0,0,0,0,0,0,0,1,0,0,FALSE,FALSE,FALSE,TRUE,TRUE,1,x,1,failed 1 coral 1 net. missed a net shot and then struggled to get it into the processor before giving up and getting stuck on an algae and struggling to get off and needing help. then they scored a single L1 before failing to deep-climb. removed one algae in an attempt to score.,,1,"3284,1","12,R1",0,1,0,0,1,1,1,x,1
12,R2,2129,TRUE,0,0,0,0,0,0,6,3,2,1,0,0,FALSE,FALSE,FALSE,FALSE,FALSE,2,x,3,Very slow in auto. Overall kind of slow. Very accurate,,1,"2129,1","12,R2",0,1,0,0,0,0,2,x,3
12,R3,494,TRUE,2,0,0,0,0,0,2,5,4,0,2,0,FALSE,TRUE,FALSE,FALSE,TRUE,2,x,2,"Got in teammates way a couple times, drove very slow, the elevator shakes a lot while scoring l4",,1,"494,1","12,R3",0,1,1,0,0,1,2,x,2
13,B1,1369,TRUE,1,0,0,0,0,1,0,0,0,1,2,4,FALSE,FALSE,FALSE,TRUE,TRUE,2,x,2,"Mostly work on algae, sometimes takes time to grab algae. Algae work better than coral, couldnt aim well in coral and also takes time on getting coral",,1,"1369,1","13,B1",0,1,0,0,1,1,2,x,2
13,B2,1671,TRUE,1,0,0,0,0,0,6,3,1,0,0,1,FALSE,FALSE,FALSE,TRUE,TRUE,3,x,2,Auto was too fast,,2,"1671,2","13,B2",0,1,0,0,1,1,3,x,2
13,B3,3492,TRUE,0,0,1,0,0,0,0,5,6,1,0,0,FALSE,FALSE,FALSE,TRUE,FALSE,x,x,2,"Very fast cycle time, number almost came off.",,2,"3492,2","13,B3",0,1,0,0,1,0,x,x,2
13,R1,4500,TRUE,1,0,0,1,0,0,6,6,0,1,0,0,FALSE,TRUE,FALSE,FALSE,TRUE,3,x,3,"Minimal misses, pretty decent speeded cycles, auto missed one L4, got the second, and almost got a third. Id say its a pretty good bot.",,1,"4500,1","13,R1",0,1,1,0,0,1,3,x,3
13,R2,2438,TRUE,0,0,0,0,0,0,4,2,0,0,0,0,FALSE,FALSE,FALSE,TRUE,FALSE,2,x,1,Very inaccurate when scoring L4  Robot cycles pretty fast but often aligns L4 too fast. It missed l4 probably around half the time Their auto failed completely,,1,"2438,1","13,R2",0,1,0,0,1,0,2,x,1
13,R3,6832,TRUE,0,0,0,0,0,0,0,0,0,0,2,0,FALSE,FALSE,FALSE,FALSE,FALSE,1,x,1,Mainly kit bot with a processor only algae intake also got the preloaded coral stuck in the lower portion in auto,,2,"6832,2","13,R3",0,1,0,0,0,0,1,x,1
14,B1,9484,TRUE,0,0,0,0,0,0,3,0,0,0,0,0,FALSE,FALSE,FALSE,TRUE,FALSE,x,2,x,"Mostly work on coral, but sometimes couldnt hold it well. Go play defense in seconds before end, doing fine.",,2,"9484,2","14,B1",0,1,0,0,1,0,x,2,x
14,B2,6911,TRUE,1,0,0,0,0,2,4,5,1,0,0,2,FALSE,FALSE,FALSE,TRUE,TRUE,3,x,3,Incredible algae claw,,2,"6911,2","14,B2",0,1,0,0,1,1,3,x,3
14,B3,3792,TRUE,0,0,0,0,0,0,0,0,0,10,4,0,FALSE,TRUE,FALSE,FALSE,FALSE,x,x,3,"Did not score in auto, only scores L1 but is very fast and consistent lightweight, fast climb",,2,"3792,2","14,B3",0,1,1,0,0,0,x,x,3
14,R1,10291,TRUE,1,0,0,0,0,0,0,4,1,2,0,0,FALSE,TRUE,FALSE,FALSE,TRUE,2,x,2,"Fast cycles, missed a decent chunk of shots, but it had a ground intake, which allowed it to recover pretty well. Auto could only score one, after that it sorta drove around.",,2,"10291,2","14,R1",0,1,1,0,0,1,2,x,2
14,R2,1833,TRUE,2,0,0,0,0,0,1,3,2,0,0,0,FALSE,TRUE,FALSE,FALSE,FALSE,2,x,2,Wobbly and inconsistent  Robot would often jolt around and it seemed like the drive team wasnt controlling it  Very clean auto though,,2,"1833,2","14,R2",0,1,1,0,0,0,2,x,2
14,R3,4068,TRUE,2,0,0,0,0,0,4,4,4,0,2,0,FALSE,FALSE,FALSE,TRUE,TRUE,3,x,3,Had very fast cycles and was able to clear algae from the reef into the processor,,2,"4068,2","14,R3",0,1,0,0,1,1,3,x,3
15,B1,3256,TRUE,3,0,0,0,0,0,2,4,6,0,0,1,FALSE,FALSE,FALSE,TRUE,TRUE,3,x,3,"Everything smoothly and fast, can work on both coral and algae. Doing well in auto. Climb successfully.",,2,"3256,2","15,B1",0,1,0,0,1,1,3,x,3
15,B2,302,TRUE,3,0,0,0,0,0,2,5,4,0,0,1,FALSE,FALSE,FALSE,TRUE,TRUE,3,x,2,Can grab algae while holding coral,,2,"302,2","15,B2",0,1,0,0,1,1,3,x,2
15,B3,4421,TRUE,1,0,0,0,0,0,1,4,0,0,2,0,FALSE,FALSE,FALSE,TRUE,FALSE,x,x,2,"Slower cycle time, auto is ment for one L4 and 2 alge.",,2,"4421,2","15,B3",0,1,0,0,1,0,x,x,2
15,R1,1796,TRUE,2,0,0,0,0,0,4,7,3,0,0,2,FALSE,TRUE,FALSE,FALSE,TRUE,3,x,3,"Crazy fast and accurate, only missed a few times, but that doesnt matter when they cycle at insane speed with most of not almost all their shots going in, and they scored everywhere but the processor and L1.",,2,"1796,2","15,R1",0,1,1,0,0,1,3,x,3
15,R2,9199,TRUE,0,0,0,0,0,0,1,0,1,0,0,0,TRUE,TRUE,FALSE,FALSE,FALSE,1,1,1,Auto bugged out and had to get e stopped Missed four L4s  Missed a L3  Algae got stuck in robot and jammed   Their elevator,,2,"9199,2","15,R2",1,1,1,0,0,0,1,1,1
15,R3,78,TRUE,3,0,0,0,0,0,1,4,3,0,2,1,FALSE,TRUE,FALSE,FALSE,TRUE,3,x,3,"Was very fast with a near 4 coral auto, also had a very quick deep climb",,2,"78,2","15,R3",0,1,1,0,0,1,3,x,3
16,B1,4786,TRUE,1,0,0,0,0,2,3,4,4,0,0,3,FALSE,FALSE,FALSE,TRUE,TRUE,3,x,3,"Working well in auto, can work on both algae and coral. Move, aiming and getting coral smoothly and fast.",,2,"4786,2","16,B1",0,1,0,0,1,1,3,x,3
16,B2,7034,TRUE,2,0,0,0,0,0,3,3,0,3,0,0,FALSE,FALSE,FALSE,TRUE,FALSE,3,x,2,"Scoring is very effective, occasionally missed in L1. Climbed, but was in contact w another robot",,2,"7034,2","16,B2",0,1,0,0,1,0,3,x,2
16,B3,1425,TRUE,3,0,0,0,0,0,1,4,6,4,0,0,FALSE,FALSE,FALSE,TRUE,FALSE,x,x,3,"Very high scoring auto, very fast cycle time",,2,"1425,2","16,B3",0,1,0,0,1,0,x,x,3
16,R1,4607,TRUE,1,0,0,0,0,0,7,2,0,0,0,5,FALSE,FALSE,FALSE,TRUE,TRUE,2,x,3,"It was accurate, but its speed was ok. Alge shots were really good though. I think its a well rounded robot, but a better alge bot for sure.",,2,"4607,2","16,R1",0,1,0,0,1,1,2,x,3
16,R2,9312,TRUE,0,0,0,0,0,0,0,0,0,1,0,0,FALSE,TRUE,FALSE,FALSE,FALSE,1,x,1,Missed L1 very often  Very inconsistent  Intake jammed,,2,"9312,2","16,R2",0,1,1,0,0,0,1,x,1
16,R3,6146,TRUE,0,0,0,0,0,0,2,4,1,1,0,0,FALSE,FALSE,FALSE,TRUE,FALSE,2,x,2,"Missed there auto coral, dropped a coral in tele op and had very slow outtake",,2,"6146,2","16,R3",0,1,0,0,1,0,2,x,2
17,B1,2056,TRUE,5,0,0,0,0,0,2,2,4,6,2,5,FALSE,TRUE,FALSE,FALSE,TRUE,3,x,3,"Doing so well in auto, can work on both algae and coral. Do everything fast and smoothly. Can get coral from ground, climb fast and success.",,2,"2056,2","17,B1",0,1,1,0,0,1,3,x,3
17,B2,9280,TRUE,0,0,0,0,0,0,2,4,2,1,0,0,FALSE,FALSE,FALSE,TRUE,FALSE,2,x,2,Auto very slow,,2,"9280,2","17,B2",0,1,0,0,1,0,2,x,2
17,B3,900,TRUE,1,0,0,0,0,0,3,3,5,0,0,0,FALSE,FALSE,FALSE,TRUE,FALSE,x,x,1,"Fast cycle time but not very accurate, non functional three coral auto",,2,"900,2","17,B3",0,1,0,0,1,0,x,x,1
17,R1,6348,TRUE,0,0,0,0,0,0,3,2,1,0,0,0,FALSE,FALSE,FALSE,TRUE,FALSE,1,x,3,"Very very very slow, but it can score in upper reef levels.",,2,"6348,2","17,R1",0,1,0,0,1,0,1,x,3
17,R2,2724,TRUE,0,0,0,0,0,0,0,1,1,1,2,0,FALSE,FALSE,FALSE,TRUE,TRUE,1,x,1,Only good for algae processing  Missed almost all coral attempts  Slow and very inconsistent,,2,"2724,2","17,R2",0,1,0,0,1,1,1,x,1
17,R3,1678,TRUE,4,0,0,0,0,0,3,5,8,0,0,0,FALSE,TRUE,FALSE,FALSE,TRUE,3,x,2,Had very fast cycles and could clear the reef but missed its attempts at getting into the net,,2,"1678,2","17,R3",0,1,1,0,0,1,3,x,2
18,B1,1481,TRUE,1,0,0,0,0,0,0,1,1,1,0,0,FALSE,FALSE,FALSE,TRUE,TRUE,x,x,x,"Can work on both algae and coral, but sometimes cant hold them well. Should be able to put algae in net but cant control well. Climb fast and successfully",,2,"1481,2","18,B1",0,1,0,0,1,1,x,x,x
18,B2,8808,TRUE,1,0,0,0,0,0,7,0,0,0,0,0,FALSE,FALSE,FALSE,TRUE,FALSE,2,x,2,Ground intake,,2,"8808,2","18,B2",0,1,0,0,1,0,2,x,2
18,B3,6424,TRUE,2,0,0,0,0,0,2,7,1,0,2,0,FALSE,TRUE,FALSE,FALSE,FALSE,x,x,3,"Very fast cycle time, simple intake, fast climb",,2,"6424,2","18,B3",0,1,1,0,0,0,x,x,3
18,R1,10260,TRUE,0,0,0,0,0,0,0,0,0,0,0,0,TRUE,FALSE,FALSE,TRUE,FALSE,x,2,x,"They were disabled mid match, auto only moved forward, they played def the whole match. Ok def, they just blocked one coral station the whole time, and werent very active when it came to disrupting the other team, more just being an inconvenience.",,2,"10260,2","18,R1",1,1,0,0,1,0,x,2,x
18,R2,3297,TRUE,1,0,0,0,0,1,6,0,2,1,1,0,FALSE,TRUE,FALSE,FALSE,FALSE,2,x,3,"Slow cycle time, pretty accurate, ground intake speeds up process a little bit. Doesn't struggle to intake from station",,2,"3297,2","18,R2",0,1,1,0,0,0,2,x,3
18,R3,4655,TRUE,3,0,0,0,0,0,1,8,6,0,1,0,FALSE,TRUE,FALSE,FALSE,TRUE,3,x,3,"Was able to quickly score on L2 and L3 while leaving L4 for the other alliance members, was also able to clear the reef",,2,"4655,2","18,R3",0,1,1,0,0,1,3,x,3
19,B1,6995,FALSE,0,0,0,0,0,0,2,4,2,0,2,2,FALSE,FALSE,FALSE,TRUE,TRUE,x,x,3,"Primarily algae based strategy, but can score coral. No auto and kind of slow, no auto . good robot with a wide range.",,2,"6995,2","19,B1",0,0,0,0,1,1,x,x,3
19,B2,4005,TRUE,1,0,0,0,0,0,1,4,3,0,0,0,FALSE,FALSE,FALSE,TRUE,FALSE,2,x,2,Missed multiple coral on l4. Took a while to climb,,2,"4005,2","19,B2",0,1,0,0,1,0,2,x,2
19,B3,9032,TRUE,3,0,0,0,0,0,4,3,4,0,0,2,FALSE,FALSE,FALSE,TRUE,TRUE,3,x,3,"Didnt miss any shots, very effective ground intake, fast driving",,2,"9032,2","19,B3",0,1,0,0,1,1,3,x,3
19,R1,7257,TRUE,0,0,0,0,0,0,1,1,0,0,0,0,FALSE,TRUE,FALSE,FALSE,FALSE,x,x,x,,,2,"7257,2","19,R1",0,1,1,0,0,0,x,x,x
19,R2,3173,TRUE,2,0,0,0,0,0,2,2,0,3,2,3,FALSE,TRUE,FALSE,FALSE,TRUE,3,x,2,"Reliable for net scoring, L3-L1 scoring, and processor scoring, good cycle time, not reliable for L4 whatsoever. Wasted a bit of time and scoring opportunities trying to score L4",,2,"3173,2","19,R2",0,1,1,0,0,1,3,x,2
19,R3,3891,TRUE,0,0,0,0,0,0,0,7,2,0,0,0,FALSE,FALSE,FALSE,TRUE,FALSE,2,x,2,"Missed some on L2 and L3 but generally pretty accurate, no algae. Can score coral anywhere.",,2,"3891,2","19,R3",0,1,0,0,1,0,2,x,2
20,B1,1731,TRUE,3,0,0,0,0,0,7,3,1,0,0,0,FALSE,TRUE,FALSE,FALSE,TRUE,3,x,3,3.5 sucessful that knocked alge. very good robot that clears while it outtakes.,,2,"1731,2","20,B1",0,1,1,0,0,1,3,x,3
20,B2,2129,TRUE,0,0,0,0,0,0,0,0,0,0,0,0,TRUE,FALSE,FALSE,TRUE,FALSE,x,x,x,"Hit other robot in auto. Couldnt drive after auto, would only very slowly spin and slightly slide to one side. Got back moving just in time to park",,2,"2129,2","20,B2",1,1,0,0,1,0,x,x,x
20,B3,4613,TRUE,0,1,0,0,0,1,0,4,6,1,0,0,FALSE,FALSE,FALSE,TRUE,TRUE,2,x,2,"Scored a algae back onto reef, got in teammates way a lot, can hold algae and coral at same time",,2,"4613,2","20,B3",0,1,0,0,1,1,2,x,2
20,R1,3255,TRUE,1,0,0,0,0,0,1,3,0,0,0,1,FALSE,TRUE,FALSE,FALSE,FALSE,x,x,2,"Very accurate with coral, but missed 2 out of 3 shots into the barge with algae. Got algae stuck in elevator for most of teleop",,2,"3255,2","20,R1",0,1,1,0,0,0,x,x,2
20,R2,418,TRUE,2,0,0,0,0,0,7,1,0,2,0,0,FALSE,TRUE,FALSE,FALSE,TRUE,3,x,3,"Note: they almost have a 3 coral auto, but technically the 3rd one was scored in teleop because it wasnt fully on the branch. Good cycle times, great accuracy, struggles with scoring on the back of the reef, reliable for algae removal",,2,"418,2","20,R2",0,1,1,0,0,1,3,x,3
20,R3,1847,TRUE,0,0,0,0,0,0,0,5,5,0,0,0,FALSE,TRUE,FALSE,FALSE,FALSE,2,x,2,"Ok cycles, no algae. Can score all levels. One coral auto (missed). Ok accuracy, mostly missed L1s.",,2,"1847,2","20,R3",0,1,1,0,0,0,2,x,2
21,B1,10698,TRUE,0,0,0,0,0,0,1,2,0,0,0,0,FALSE,FALSE,FALSE,TRUE,TRUE,1,x,2,failed 1 coral. droped some coral and the robot has a bit of a jitter that complicates scoring.  removed an algae with its arm. no attempt to climb,,2,"10698,2","21,B1",0,1,0,0,1,1,1,x,2
21,B2,4451,TRUE,0,0,0,0,0,0,4,0,0,0,0,0,FALSE,FALSE,FALSE,TRUE,FALSE,2,1,2,"Couldnt align with cage even though they went to line up with 25 seconds left. Switched to defense halfway through, but just sat in front of a coral station",,2,"4451,2","21,B2",0,1,0,0,1,0,2,1,2
